{
  "findings": [
    {
      "title": "External call before state update in Collect",
      "category": "reentrancy",
      "severity": "medium",
      "confidence": 0.5,
      "evidence": {
        "file": "W_WALLET.sol",
        "lines": [
          21,
          22,
          23
        ],
        "function": "Collect"
      },
      "explanation": "The contract invokes msg.sender.call.value(_am)() before updating the internal balance. A malicious contract can re-enter Collect in its fallback and withdraw repeatedly until exhausting the balance.",
      "fix_suggestion": "",
      "key_variables": [],
      "key_statements": [],
      "scenario_matched": "",
      "property_verified": "",
      "static_check_type": "",
      "source": "",
      "static_confirmed": null,
      "static_check_reason": ""
    },
    {
      "title": "Use of low-level call without proper revert",
      "category": "unchecked_low_level_calls",
      "severity": "medium",
      "confidence": 0.5,
      "evidence": {
        "file": "W_WALLET.sol",
        "lines": [
          21
        ],
        "function": "Collect"
      },
      "explanation": "The contract uses msg.sender.call.value(_am)() for withdrawing. If the call fails, it returns false and the contract continues without reverting, potentially leaving funds locked or logs out of sync.",
      "fix_suggestion": "",
      "key_variables": [],
      "key_statements": [],
      "scenario_matched": "",
      "property_verified": "",
      "static_check_type": "",
      "source": "",
      "static_confirmed": null,
      "static_check_reason": ""
    },
    {
      "title": "Unchecked arithmetic operations on balance",
      "category": "arithmetic",
      "severity": "medium",
      "confidence": 0.5,
      "evidence": {
        "file": "W_WALLET.sol",
        "lines": [
          11,
          22
        ],
        "function": "Put & Collect"
      },
      "explanation": "The contract updates acc.balance with plain += and -= without SafeMath. Large deposits could overflow, or malicious _am values (in combination with reentrancy) could underflow.",
      "fix_suggestion": "",
      "key_variables": [],
      "key_statements": [],
      "scenario_matched": "",
      "property_verified": "",
      "static_check_type": "",
      "source": "",
      "static_confirmed": null,
      "static_check_reason": ""
    },
    {
      "title": "Locked funds if low-level call fails",
      "category": "denial_of_service",
      "severity": "medium",
      "confidence": 0.5,
      "evidence": {
        "file": "W_WALLET.sol",
        "lines": [
          21,
          22,
          23
        ],
        "function": "Collect"
      },
      "explanation": "If the recipient\u2019s fallback function reverts, msg.sender.call.value(_am)() returns false. The contract does not revert, so the user\u2019s balance remains unchanged but they cannot recover funds, effectively locking them.",
      "fix_suggestion": "",
      "key_variables": [],
      "key_statements": [],
      "scenario_matched": "",
      "property_verified": "",
      "static_check_type": "",
      "source": "",
      "static_confirmed": null,
      "static_check_reason": ""
    }
  ],
  "parse_errors": [],
  "finding_count": 4,
  "ground_truth": [
    {
      "category": "reentrancy",
      "lines": [
        29
      ],
      "title": "Reentrancy"
    }
  ],
  "metrics": {
    "category_metrics": {
      "precision": 0.25,
      "recall": 1.0,
      "f1": 0.4,
      "tp": 1,
      "fp": 3,
      "fn": 0,
      "pred_categories": [
        "unchecked_low_level_calls",
        "reentrancy",
        "denial_of_service",
        "arithmetic"
      ],
      "gt_categories": [
        "reentrancy"
      ],
      "matched_categories": [
        "reentrancy"
      ],
      "missed_categories": [],
      "spurious_categories": [
        "unchecked_low_level_calls",
        "denial_of_service",
        "arithmetic"
      ],
      "unknown_predictions": 0
    },
    "instance_metrics": {
      "precision": 0.0,
      "recall": 0.0,
      "f1": 0.0,
      "tp": 0,
      "fp": 4,
      "fn": 1,
      "matched_instances": [],
      "unmatched_predictions": [
        {
          "category": "reentrancy",
          "lines": [
            21,
            22,
            23
          ],
          "title": "External call before state update in Collect"
        },
        {
          "category": "unchecked_low_level_calls",
          "lines": [
            21
          ],
          "title": "Use of low-level call without proper revert"
        },
        {
          "category": "arithmetic",
          "lines": [
            11,
            22
          ],
          "title": "Unchecked arithmetic operations on balance"
        },
        {
          "category": "denial_of_service",
          "lines": [
            21,
            22,
            23
          ],
          "title": "Locked funds if low-level call fails"
        }
      ],
      "unmatched_ground_truth": [
        {
          "category": "reentrancy",
          "lines": [
            29
          ]
        }
      ],
      "has_line_annotations": true
    },
    "precision": 0.25,
    "recall": 1.0,
    "f1": 0.4,
    "tp": 1,
    "fp": 3,
    "fn": 0,
    "pred_categories": [
      "unchecked_low_level_calls",
      "reentrancy",
      "denial_of_service",
      "arithmetic"
    ],
    "gt_categories": [
      "reentrancy"
    ],
    "matched_categories": [
      "reentrancy"
    ],
    "missed_categories": [],
    "spurious_categories": [
      "unchecked_low_level_calls",
      "denial_of_service",
      "arithmetic"
    ],
    "unknown_predictions": 0
  },
  "loc": {
    "loc_total": 84,
    "loc_code": 65,
    "loc_comments": 4,
    "loc_blank": 15
  },
  "runner_metadata": {
    "parse_errors": [],
    "raw_output": "Part 1 \u2013 Project Background  \nW_WALLET is a simple on-chain \u201ctime-locked piggy bank.\u201d Users can deposit ETH and optionally specify an unlock timestamp. Once the specified time has passed and their deposit meets a minimum threshold, they can withdraw up to the amount they deposited. Every deposit and successful withdrawal is recorded in an external Log contract for on-chain auditing. The main goals are:  \n\u2022 Allow users to store funds on-chain with a user-defined lockup period.  \n\u2022 Enforce a minimum deposit value (MinSum = 1 ETH).  \n\u2022 Provide a transparent, append-only log of all deposits and withdrawals via a separate Log contract.  \n\nPart 2 \u2013 Function Summary and Call Relationships  \n(Line numbers refer to the snippet as numbered below.)\n\n```text\n 1  /*\n 2   * @source...\n 3   */\n 4  pragma solidity ^0.4.25;\n 5\n 6  contract W_WALLET {\n 7      function Put(uint _unlockTime)       // [10\u201318]\n 8          public payable\n 9      {\n10         var acc = Acc[msg.sender];\n11         acc.balance += msg.value;\n12         acc.unlockTime = _unlockTime > now ? _unlockTime : now;\n13         LogFile.AddMessage(msg.sender, msg.value, \"Put\");\n14      }\n15\n16      function Collect(uint _am)          // [20\u201334]\n17          public payable\n18      {\n19         var acc = Acc[msg.sender];\n20         if (acc.balance >= MinSum && acc.balance >= _am && now > acc.unlockTime) {\n21             if (msg.sender.call.value(_am)()) {\n22                 acc.balance -= _am;\n23                 LogFile.AddMessage(msg.sender, _am, \"Collect\");\n24             }\n25         }\n26      }\n27\n28      function()                           // [36\u201341]\n29          public payable\n30      {\n31         Put(0);                          // fallback delegates to Put\n32      }\n33\n34      struct Holder {                     // [43\u201347]\n35          uint unlockTime;\n36          uint balance;\n37      }\n38\n39      mapping(address => Holder) public Acc; // [49]\n40      Log public LogFile;                   // [51]\n41      uint public MinSum = 1 ether;         // [53]\n42\n43      function W_WALLET(address log) public {  // [55\u201357]\n44          LogFile = Log(log);  \n45      }\n46  }\n47\n48  contract Log {\n49      struct Message {                    // [62\u201368]\n50          address Sender;\n51          string  Data;\n52          uint    Val;\n53          uint    Time;\n54      }\n55      Message[] public History;           // [70]\n56      Message     LastMsg;                // [72]\n57\n58      function AddMessage(address _adr, uint _val, string _data)  // [74\u201382]\n59          public\n60      {\n61         LastMsg.Sender = _adr;\n62         LastMsg.Time   = now;\n63         LastMsg.Val    = _val;\n64         LastMsg.Data   = _data;\n65         History.push(LastMsg);\n66      }\n67  }\n```\n\n\u2022 Put (lines 10\u201313): Accepts ETH, updates the caller\u2019s balance/unlock time, and logs the deposit.  \n\u2022 Collect (lines 19\u201324): Checks that the caller\u2019s balance \u2265 MinSum, that the requested amount \u2264 their balance, and that the unlock time has passed. If so, it forwards ETH via `msg.sender.call.value(...)()`, then reduces the internal balance and logs the withdrawal.  \n\u2022 Fallback (lines 28\u201331): Redirects any plain\u2010ETH send to `Put(0)`, effectively letting users deposit without data.  \n\u2022 Constructor (lines 43\u201345): Sets the Log contract address.  \n\u2022 Log.AddMessage (lines 61\u201365): Records sender, value, text, and timestamp in an append-only array.  \n\nCall Relationships:  \n\u2022 Fallback \u2192 Put  \n\u2022 Put/Collect \u2192 Log.AddMessage  \n\u2022 Collect \u2192 external call to msg.sender (low-level call)  \n\nPart 3 \u2013 DASP Top 10 Vulnerability Assessment  \n{  \n  reentrancy: 1,  \n  access_control: 0,  \n  arithmetic: 1,  \n  unchecked_low_level_calls: 1,  \n  denial_of_service: 1,  \n  bad_randomness: 0,  \n  front_running: 0,  \n  time_manipulation: 0,  \n  short_addresses: 0,  \n  other: 0  \n}  \n\nIdentified issues and code snippets:  \n1) Reentrancy (Collect, lines 21\u201323): external call to `msg.sender.call.value(...)()` occurs before the balance is decremented, allowing a malicious contract to re-enter Collect and drain funds.  \n2) Unchecked Low-Level Call (Collect, line 21): the low-level call return value is checked but the call itself can succeed or fail silently, leading to unexpected behavior and blocked funds.  \n3) Arithmetic (Put/Collect, lines 11 & 22): `acc.balance += msg.value` and `acc.balance -= _am` use unchecked math, opening up potential overflows/underflows.  \n4) Denial of Service (Collect, lines 21\u201324): if the recipient\u2019s fallback reverts, `msg.sender.call.value(...)()` returns false, skipping both the balance decrement and logging, but does not revert the transaction\u2014effectively locking the user\u2019s funds forever.  \n\nPart 4 \u2013 Structured JSON Output  \n```json\n[\n  {\n    \"category\": \"reentrancy\",\n    \"title\": \"External call before state update in Collect\",\n    \"evidence\": {\n      \"file\": \"W_WALLET.sol\",\n      \"lines\": [21,22,23],\n      \"function\": \"Collect\"\n    },\n    \"explanation\": \"The contract invokes msg.sender.call.value(_am)() before updating the internal balance. A malicious contract can re-enter Collect in its fallback and withdraw repeatedly until exhausting the balance.\",\n    \"influence_scope\": {\n      \"functions\": [\"Collect\"],\n      \"lines\": [19,20,21,22,23]\n    }\n  },\n  {\n    \"category\": \"unchecked_low_level_calls\",\n    \"title\": \"Use of low-level call without proper revert\",\n    \"evidence\": {\n      \"file\": \"W_WALLET.sol\",\n      \"lines\": [21],\n      \"function\": \"Collect\"\n    },\n    \"explanation\": \"The contract uses msg.sender.call.value(_am)() for withdrawing. If the call fails, it returns false and the contract continues without reverting, potentially leaving funds locked or logs out of sync.\",\n    \"influence_scope\": {\n      \"functions\": [\"Collect\"],\n      \"lines\": [21]\n    }\n  },\n  {\n    \"category\": \"arithmetic\",\n    \"title\": \"Unchecked arithmetic operations on balance\",\n    \"evidence\": {\n      \"file\": \"W_WALLET.sol\",\n      \"lines\": [11,22],\n      \"function\": \"Put & Collect\"\n    },\n    \"explanation\": \"The contract updates acc.balance with plain += and -= without SafeMath. Large deposits could overflow, or malicious _am values (in combination with reentrancy) could underflow.\",\n    \"influence_scope\": {\n      \"functions\": [\"Put\", \"Collect\"],\n      \"lines\": [11,22]\n    }\n  },\n  {\n    \"category\": \"denial_of_service\",\n    \"title\": \"Locked funds if low-level call fails\",\n    \"evidence\": {\n      \"file\": \"W_WALLET.sol\",\n      \"lines\": [21,22,23],\n      \"function\": \"Collect\"\n    },\n    \"explanation\": \"If the recipient\u2019s fallback function reverts, msg.sender.call.value(_am)() returns false. The contract does not revert, so the user\u2019s balance remains unchanged but they cannot recover funds, effectively locking them.\",\n    \"influence_scope\": {\n      \"functions\": [\"Collect\"],\n      \"lines\": [21,22,23]\n    }\n  }\n]\n```",
    "rendered_prompt": "You are a smart contract analyzer. You need to fully read the smart contracts code that I provide you later and understand and also carefully consider the inner logics of functions, explain the function call relationship, and the role of the call. There is no need to explain ERC20, ERC721, ERC777 function, and also function variable naming convention and other information. After that, you need to lead me to fully understand them.\n\nResponse requirements:\nDivide the analysis into three parts. You are required to strictly follow the steps of first, second and third part to think step by step when giving responses.\n\nIn the first part: introduce the project background, what tasks the contracts are executing, and the goals they aim to achieve.\n\nIn the second part: identify the function locations by line number, the purpose of each function, and whether there are any call relationships. If there are, explain how the functions are called and the purpose of these calls.\n\nIn the third part: You should further audit the above file. Here are the DASP Top 10 vulnerability categories: {reentrancy, access_control, arithmetic, unchecked_low_level_calls, denial_of_service, bad_randomness, front_running, time_manipulation, short_addresses, other}. You need to combine the context and comprehensive analysis to detect whether there are the mentioned vulnerabilities in smart contracts. If it exists, answer 1. Otherwise, answer 0 such as {reentrancy: 1, ..., other: 0}. Moreover, you need to locate these vulnerabilities in smart contracts and show me the code snippets that have these vulnerabilities, such as {function withdraw {...}} and show the scope of vulnerabilities' influence {what functions and what lines of code are influenced}.\n\nIn the fourth part: After completing the analysis above, compile your findings into a JSON array for systematic processing:\n\n```json\n[\n  {\n    \"category\": \"DASP category (reentrancy, access_control, arithmetic, etc.)\",\n    \"title\": \"Brief vulnerability title\",\n    \"evidence\": {\n      \"file\": \"filename.sol\",\n      \"lines\": [line_numbers],\n      \"function\": \"functionName\"\n    },\n    \"explanation\": \"Detailed explanation of the vulnerability and how it could be exploited\",\n    \"influence_scope\": {\n      \"functions\": [\"list\", \"of\", \"affected\", \"functions\"],\n      \"lines\": [list, of, affected, lines]\n    }\n  }\n]\n```\n\nReturn [] if no vulnerabilities are found after completing the full analysis.\n\n---\n\n## CONTRACT TO AUDIT:\n```solidity\n/*\n * @source: etherscan.io \n * @author: -\n \n */\n\npragma solidity ^0.4.25;\n\ncontract W_WALLET\n{\n    function Put(uint _unlockTime)\n    public\n    payable\n    {\n        var acc = Acc[msg.sender];\n        acc.balance += msg.value;\n        acc.unlockTime = _unlockTime>now?_unlockTime:now;\n        LogFile.AddMessage(msg.sender,msg.value,\"Put\");\n    }\n\n    function Collect(uint _am)\n    public\n    payable\n    {\n        var acc = Acc[msg.sender];\n        if( acc.balance>=MinSum && acc.balance>=_am && now>acc.unlockTime)\n        {\n            \n            if(msg.sender.call.value(_am)())\n            {\n                acc.balance-=_am;\n                LogFile.AddMessage(msg.sender,_am,\"Collect\");\n            }\n        }\n    }\n\n    function() \n    public \n    payable\n    {\n        Put(0);\n    }\n\n    struct Holder   \n    {\n        uint unlockTime;\n        uint balance;\n    }\n\n    mapping (address => Holder) public Acc;\n\n    Log LogFile;\n\n    uint public MinSum = 1 ether;    \n\n    function W_WALLET(address log) public{\n        LogFile = Log(log);\n    }\n}\n\ncontract Log \n{\n    struct Message\n    {\n        address Sender;\n        string  Data;\n        uint Val;\n        uint  Time;\n    }\n\n    Message[] public History;\n\n    Message LastMsg;\n\n    function AddMessage(address _adr,uint _val,string _data)\n    public\n    {\n        LastMsg.Sender = _adr;\n        LastMsg.Time = now;\n        LastMsg.Val = _val;\n        LastMsg.Data = _data;\n        History.push(LastMsg);\n    }\n}\n```\n\nNow perform the complete analysis. Think step by step through each part before providing your final JSON output.",
    "api_calls": 1,
    "latency_s": 67.95630812644958,
    "prompt_tokens": 913,
    "completion_tokens": 4313,
    "total_tokens": 5226,
    "cost_usd": 0.019981500000000003
  }
}