{
  "findings": [
    {
      "title": "Reentrancy in Collect()",
      "category": "reentrancy",
      "severity": "medium",
      "confidence": 0.5,
      "evidence": {
        "file": "X_WALLET.sol",
        "lines": [
          27,
          29
        ],
        "function": "Collect"
      },
      "explanation": "The contract calls msg.sender.call.value(_am)() before deducting the balance from Acc[msg.sender]. An attacker can reenter Collect() in their fallback and drain more funds than allowed.",
      "fix_suggestion": "",
      "key_variables": [],
      "key_statements": [],
      "scenario_matched": "",
      "property_verified": "",
      "static_check_type": "",
      "source": "",
      "static_confirmed": null,
      "static_check_reason": ""
    },
    {
      "title": "Unchecked low-level call in Collect()",
      "category": "unchecked_low_level_calls",
      "severity": "medium",
      "confidence": 0.5,
      "evidence": {
        "file": "X_WALLET.sol",
        "lines": [
          27
        ],
        "function": "Collect"
      },
      "explanation": "Using msg.sender.call.value without checking for revert properly or using transfer/send can lead to unexpected behavior and opens the door for reentrancy exploits.",
      "fix_suggestion": "",
      "key_variables": [],
      "key_statements": [],
      "scenario_matched": "",
      "property_verified": "",
      "static_check_type": "",
      "source": "",
      "static_confirmed": null,
      "static_check_reason": ""
    },
    {
      "title": "Unbounded logging can run out of gas",
      "category": "denial_of_service",
      "severity": "medium",
      "confidence": 0.5,
      "evidence": {
        "file": "X_WALLET.sol / Log.sol",
        "lines": [
          16,
          30,
          80
        ],
        "function": "Put / Collect / AddMessage"
      },
      "explanation": "The Log contract uses a dynamic array that continuously grows. Eventually pushing a new Message may exceed gas limits and revert, blocking both Put() and Collect() calls.",
      "fix_suggestion": "",
      "key_variables": [],
      "key_statements": [],
      "scenario_matched": "",
      "property_verified": "",
      "static_check_type": "",
      "source": "",
      "static_confirmed": null,
      "static_check_reason": ""
    }
  ],
  "parse_errors": [],
  "finding_count": 3,
  "ground_truth": [
    {
      "category": "reentrancy",
      "lines": [
        29
      ],
      "title": "Reentrancy"
    }
  ],
  "metrics": {
    "category_metrics": {
      "precision": 0.3333333333333333,
      "recall": 1.0,
      "f1": 0.5,
      "tp": 1,
      "fp": 2,
      "fn": 0,
      "pred_categories": [
        "reentrancy",
        "denial_of_service",
        "unchecked_low_level_calls"
      ],
      "gt_categories": [
        "reentrancy"
      ],
      "matched_categories": [
        "reentrancy"
      ],
      "missed_categories": [],
      "spurious_categories": [
        "denial_of_service",
        "unchecked_low_level_calls"
      ],
      "unknown_predictions": 0
    },
    "instance_metrics": {
      "precision": 0.3333333333333333,
      "recall": 1.0,
      "f1": 0.5,
      "tp": 1,
      "fp": 2,
      "fn": 0,
      "matched_instances": [
        {
          "category": "reentrancy",
          "pred_lines": [
            27,
            29
          ],
          "gt_lines": [
            29
          ],
          "function": "Collect"
        }
      ],
      "unmatched_predictions": [
        {
          "category": "unchecked_low_level_calls",
          "lines": [
            27
          ],
          "title": "Unchecked low-level call in Collect()"
        },
        {
          "category": "denial_of_service",
          "lines": [
            16,
            80,
            30
          ],
          "title": "Unbounded logging can run out of gas"
        }
      ],
      "unmatched_ground_truth": [],
      "has_line_annotations": true
    },
    "precision": 0.3333333333333333,
    "recall": 1.0,
    "f1": 0.5,
    "tp": 1,
    "fp": 2,
    "fn": 0,
    "pred_categories": [
      "reentrancy",
      "denial_of_service",
      "unchecked_low_level_calls"
    ],
    "gt_categories": [
      "reentrancy"
    ],
    "matched_categories": [
      "reentrancy"
    ],
    "missed_categories": [],
    "spurious_categories": [
      "denial_of_service",
      "unchecked_low_level_calls"
    ],
    "unknown_predictions": 0
  },
  "loc": {
    "loc_total": 84,
    "loc_code": 65,
    "loc_comments": 4,
    "loc_blank": 15
  },
  "runner_metadata": {
    "parse_errors": [],
    "raw_output": "Part 1: Project Background  \n- X_WALLET is a simple Ether \u201ctime\u2010locked\u201d piggy\u2010bank.  \n- Users call `Put` to deposit funds and set an unlock time; they must deposit at least the minimum (`MinSum`).  \n- After the unlock time passes and if their balance still meets the minimum, they call `Collect` to withdraw part or all of their funds.  \n- Every action (deposit or withdrawal) is recorded by an auxiliary `Log` contract via `AddMessage`.  \n\nPart 2: Function Inventory and Call Relationships  \nAssumed line numbers (for reference):  \n```\n 9  function Put(uint _unlockTime) public payable { \u2026 }  \n19  function Collect(uint _am)   public payable { \u2026 }  \n35  function()               public payable { \u2026 }  \n54  function X_WALLET(address log) public { \u2026 }  \n73  function AddMessage(address _adr,uint _val,string _data) public { \u2026 }  \n```\n\n1. Put (lines 9\u201317)  \n   - Increases caller\u2019s recorded balance by `msg.value`.  \n   - Sets their unlock time to either the supplied `_unlockTime` (if in the future) or `now`.  \n   - Calls `LogFile.AddMessage` to record the deposit.  \n\n2. Collect (lines 19\u201333)  \n   - Reads caller\u2019s `Holder` record.  \n   - Checks three conditions:  \n     \u2022 recorded balance \u2265 `MinSum`  \n     \u2022 recorded balance \u2265 requested amount `_am`  \n     \u2022 `now` > recorded unlock time  \n   - If all pass, performs a low\u2010level `msg.sender.call.value(_am)()` to send Ether.  \n   - On success, subtracts `_am` from their recorded balance and logs the withdrawal via `LogFile.AddMessage`.  \n\n3. Fallback (lines 35\u201340)  \n   - For plain Ether transfers, automatically calls `Put(0)`, treating the transfer as a deposit with unlock time = now.  \n\n4. Constructor (lines 54\u201356)  \n   - Initializes the `LogFile` reference to the externally\u2010deployed `Log` contract.  \n\n5. Log.AddMessage (lines 73\u201381)  \n   - Updates a temporary `LastMsg` struct and pushes it into a dynamic `History` array for on\u2010chain event logging.  \n\nCall Relationships:  \n- `fallback` \u2192 `Put`  \n- `Put` \u2192 `LogFile.AddMessage`  \n- `Collect` \u2192 external `msg.sender.call.value(...)` \u2192 caller\u2019s fallback  \n- `Collect` \u2192 `LogFile.AddMessage`  \n\nPart 3: Vulnerability Assessment (DASP Top\u200910)  \n- reentrancy: 1  \n- access_control: 0  \n- arithmetic: 0  \n- unchecked_low_level_calls: 1  \n- denial_of_service: 1  \n- bad_randomness: 0  \n- front_running: 0  \n- time_manipulation: 0  \n- short_addresses: 0  \n- other: 0  \n\nIdentified issues:  \n1. Reentrancy (Collect uses `call.value` before updating balance)  \n2. Unchecked low\u2010level call (no proper revert or safe send)  \n3. Denial-of-service in logging (unbounded array growth in `Log.AddMessage` can eventually run out of gas and block all logging, thus blocking deposits and withdrawals)  \n\nPart 4: JSON Report  \n```json\n[\n  {\n    \"category\": \"reentrancy\",\n    \"title\": \"Reentrancy in Collect()\",\n    \"evidence\": {\n      \"file\": \"X_WALLET.sol\",\n      \"lines\": [27, 29],\n      \"function\": \"Collect\"\n    },\n    \"explanation\": \"The contract calls msg.sender.call.value(_am)() before deducting the balance from Acc[msg.sender]. An attacker can reenter Collect() in their fallback and drain more funds than allowed.\",\n    \"influence_scope\": {\n      \"functions\": [\"Collect\"],\n      \"lines\": [23, 31]\n    }\n  },\n  {\n    \"category\": \"unchecked_low_level_calls\",\n    \"title\": \"Unchecked low-level call in Collect()\",\n    \"evidence\": {\n      \"file\": \"X_WALLET.sol\",\n      \"lines\": [27],\n      \"function\": \"Collect\"\n    },\n    \"explanation\": \"Using msg.sender.call.value without checking for revert properly or using transfer/send can lead to unexpected behavior and opens the door for reentrancy exploits.\",\n    \"influence_scope\": {\n      \"functions\": [\"Collect\"],\n      \"lines\": [27]\n    }\n  },\n  {\n    \"category\": \"denial_of_service\",\n    \"title\": \"Unbounded logging can run out of gas\",\n    \"evidence\": {\n      \"file\": \"X_WALLET.sol / Log.sol\",\n      \"lines\": [16, 30, 80],\n      \"function\": \"Put / Collect / AddMessage\"\n    },\n    \"explanation\": \"The Log contract uses a dynamic array that continuously grows. Eventually pushing a new Message may exceed gas limits and revert, blocking both Put() and Collect() calls.\",\n    \"influence_scope\": {\n      \"functions\": [\"Put\", \"Collect\"],\n      \"lines\": [13, 30, 80]\n    }\n  }\n]\n```",
    "rendered_prompt": "You are a smart contract analyzer. You need to fully read the smart contracts code that I provide you later and understand and also carefully consider the inner logics of functions, explain the function call relationship, and the role of the call. There is no need to explain ERC20, ERC721, ERC777 function, and also function variable naming convention and other information. After that, you need to lead me to fully understand them.\n\nResponse requirements:\nDivide the analysis into three parts. You are required to strictly follow the steps of first, second and third part to think step by step when giving responses.\n\nIn the first part: introduce the project background, what tasks the contracts are executing, and the goals they aim to achieve.\n\nIn the second part: identify the function locations by line number, the purpose of each function, and whether there are any call relationships. If there are, explain how the functions are called and the purpose of these calls.\n\nIn the third part: You should further audit the above file. Here are the DASP Top 10 vulnerability categories: {reentrancy, access_control, arithmetic, unchecked_low_level_calls, denial_of_service, bad_randomness, front_running, time_manipulation, short_addresses, other}. You need to combine the context and comprehensive analysis to detect whether there are the mentioned vulnerabilities in smart contracts. If it exists, answer 1. Otherwise, answer 0 such as {reentrancy: 1, ..., other: 0}. Moreover, you need to locate these vulnerabilities in smart contracts and show me the code snippets that have these vulnerabilities, such as {function withdraw {...}} and show the scope of vulnerabilities' influence {what functions and what lines of code are influenced}.\n\nIn the fourth part: After completing the analysis above, compile your findings into a JSON array for systematic processing:\n\n```json\n[\n  {\n    \"category\": \"DASP category (reentrancy, access_control, arithmetic, etc.)\",\n    \"title\": \"Brief vulnerability title\",\n    \"evidence\": {\n      \"file\": \"filename.sol\",\n      \"lines\": [line_numbers],\n      \"function\": \"functionName\"\n    },\n    \"explanation\": \"Detailed explanation of the vulnerability and how it could be exploited\",\n    \"influence_scope\": {\n      \"functions\": [\"list\", \"of\", \"affected\", \"functions\"],\n      \"lines\": [list, of, affected, lines]\n    }\n  }\n]\n```\n\nReturn [] if no vulnerabilities are found after completing the full analysis.\n\n---\n\n## CONTRACT TO AUDIT:\n```solidity\n/*\n * @source: etherscan.io \n * @author: -\n \n */\n\npragma solidity ^0.4.25;\n\ncontract X_WALLET\n{\n    function Put(uint _unlockTime)\n    public\n    payable\n    {\n        var acc = Acc[msg.sender];\n        acc.balance += msg.value;\n        acc.unlockTime = _unlockTime>now?_unlockTime:now;\n        LogFile.AddMessage(msg.sender,msg.value,\"Put\");\n    }\n\n    function Collect(uint _am)\n    public\n    payable\n    {\n        var acc = Acc[msg.sender];\n        if( acc.balance>=MinSum && acc.balance>=_am && now>acc.unlockTime)\n        {\n            \n            if(msg.sender.call.value(_am)())\n            {\n                acc.balance-=_am;\n                LogFile.AddMessage(msg.sender,_am,\"Collect\");\n            }\n        }\n    }\n\n    function() \n    public \n    payable\n    {\n        Put(0);\n    }\n\n    struct Holder   \n    {\n        uint unlockTime;\n        uint balance;\n    }\n\n    mapping (address => Holder) public Acc;\n\n    Log LogFile;\n\n    uint public MinSum = 1 ether;    \n\n    function X_WALLET(address log) public{\n        LogFile = Log(log);\n    }\n}\n\ncontract Log \n{\n    struct Message\n    {\n        address Sender;\n        string  Data;\n        uint Val;\n        uint  Time;\n    }\n\n    Message[] public History;\n\n    Message LastMsg;\n\n    function AddMessage(address _adr,uint _val,string _data)\n    public\n    {\n        LastMsg.Sender = _adr;\n        LastMsg.Time = now;\n        LastMsg.Val = _val;\n        LastMsg.Data = _data;\n        History.push(LastMsg);\n    }\n}\n```\n\nNow perform the complete analysis. Think step by step through each part before providing your final JSON output.",
    "api_calls": 1,
    "latency_s": 51.867876052856445,
    "prompt_tokens": 913,
    "completion_tokens": 3322,
    "total_tokens": 4235,
    "cost_usd": 0.0156211
  }
}