{
  "findings": [
    {
      "title": "External call before state update in Collect allows reentrancy",
      "category": "reentrancy",
      "severity": "medium",
      "confidence": 0.5,
      "evidence": {
        "file": "PRIVATE_ETH_CELL.sol",
        "lines": [
          54,
          56
        ],
        "function": "Collect"
      },
      "explanation": "The contract calls msg.sender.call.value(_am)() before decrementing balances[msg.sender]. A malicious contract can reenter Collect in its fallback and repeatedly drain funds until the vault is empty.",
      "fix_suggestion": "",
      "key_variables": [],
      "key_statements": [],
      "scenario_matched": "",
      "property_verified": "",
      "static_check_type": "",
      "source": "",
      "static_confirmed": null,
      "static_check_reason": ""
    },
    {
      "title": "No ownership check on initialization functions",
      "category": "access_control",
      "severity": "medium",
      "confidence": 0.5,
      "evidence": {
        "file": "PRIVATE_ETH_CELL.sol",
        "lines": [
          19,
          26,
          33
        ],
        "function": "SetMinSum / SetLogFile / Initialized"
      },
      "explanation": "All three configuration functions are public and only gated by a boolean flag. Any user can call SetMinSum, SetLogFile or Initialized to maliciously reconfigure or freeze the contract.",
      "fix_suggestion": "",
      "key_variables": [],
      "key_statements": [],
      "scenario_matched": "",
      "property_verified": "",
      "static_check_type": "",
      "source": "",
      "static_confirmed": null,
      "static_check_reason": ""
    },
    {
      "title": "Dependency on external LogFile for successful Collect",
      "category": "denial_of_service",
      "severity": "medium",
      "confidence": 0.5,
      "evidence": {
        "file": "PRIVATE_ETH_CELL.sol",
        "lines": [
          57
        ],
        "function": "Collect"
      },
      "explanation": "After transferring ETH, Collect calls Log.AddMessage. If the external LogFile contract reverts or runs out of gas, the entire Collect transaction reverts (including the ETH transfer), effectively blocking withdrawals.",
      "fix_suggestion": "",
      "key_variables": [],
      "key_statements": [],
      "scenario_matched": "",
      "property_verified": "",
      "static_check_type": "",
      "source": "",
      "static_confirmed": null,
      "static_check_reason": ""
    }
  ],
  "parse_errors": [],
  "finding_count": 3,
  "ground_truth": [
    {
      "category": "reentrancy",
      "lines": [
        54
      ],
      "title": "Reentrancy"
    }
  ],
  "metrics": {
    "category_metrics": {
      "precision": 0.3333333333333333,
      "recall": 1.0,
      "f1": 0.5,
      "tp": 1,
      "fp": 2,
      "fn": 0,
      "pred_categories": [
        "reentrancy",
        "access_control",
        "denial_of_service"
      ],
      "gt_categories": [
        "reentrancy"
      ],
      "matched_categories": [
        "reentrancy"
      ],
      "missed_categories": [],
      "spurious_categories": [
        "access_control",
        "denial_of_service"
      ],
      "unknown_predictions": 0
    },
    "instance_metrics": {
      "precision": 0.3333333333333333,
      "recall": 1.0,
      "f1": 0.5,
      "tp": 1,
      "fp": 2,
      "fn": 0,
      "matched_instances": [
        {
          "category": "reentrancy",
          "pred_lines": [
            56,
            54
          ],
          "gt_lines": [
            54
          ],
          "function": "Collect"
        }
      ],
      "unmatched_predictions": [
        {
          "category": "access_control",
          "lines": [
            33,
            26,
            19
          ],
          "title": "No ownership check on initialization functions"
        },
        {
          "category": "denial_of_service",
          "lines": [
            57
          ],
          "title": "Dependency on external LogFile for successful Collect"
        }
      ],
      "unmatched_ground_truth": [],
      "has_line_annotations": true
    },
    "precision": 0.3333333333333333,
    "recall": 1.0,
    "f1": 0.5,
    "tp": 1,
    "fp": 2,
    "fn": 0,
    "pred_categories": [
      "reentrancy",
      "access_control",
      "denial_of_service"
    ],
    "gt_categories": [
      "reentrancy"
    ],
    "matched_categories": [
      "reentrancy"
    ],
    "missed_categories": [],
    "spurious_categories": [
      "access_control",
      "denial_of_service"
    ],
    "unknown_predictions": 0
  },
  "loc": {
    "loc_total": 94,
    "loc_code": 72,
    "loc_comments": 4,
    "loc_blank": 18
  },
  "runner_metadata": {
    "parse_errors": [],
    "raw_output": "Part 1 \u2013 Project Background  \nThe provided Solidity code implements two contracts:  \n1. **PRIVATE_ETH_CELL** \u2013 a simple ETH vault where any user can deposit and later withdraw (\u201ccollect\u201d) funds once they meet a configurable minimum balance requirement. Every deposit or withdrawal is recorded in an external logging contract.  \n2. **LogFile** \u2013 a lightweight on\u2010chain logger that records who did what (deposit or withdraw), the value, and a timestamp.  \n\nThe intended workflow is:  \n- The \u201cowner\u201d (or deployer) sets a minimum withdrawal threshold (MinSum) and points the vault to a LogFile instance via `SetMinSum` and `SetLogFile`.  \n- Once configured, the deployer calls `Initialized` to lock configuration.  \n- Users call `Deposit()` (or send ETH to the fallback) to top up their balance.  \n- Once their balance \u2265 MinSum, they call `Collect(amount)` to withdraw; successful operations are sent to the user and then logged.\n\nPart 2 \u2013 Function Breakdown & Call Relationships  \n(For reference, lines are numbered according to the pasted snippet.)\n\n1. Lines 19\u201324, `function SetMinSum(uint _val)`  \n   \u2022 Purpose: Set the minimum balance required to make a withdrawal.  \n   \u2022 Access: Public, but guarded by `require(!intitalized)`.  \n   \u2022 Relation: Standalone \u2013 does not call other contract methods.  \n\n2. Lines 26\u201331, `function SetLogFile(address _log)`  \n   \u2022 Purpose: Point the vault to an instance of `LogFile` for recording events.  \n   \u2022 Access: Public, but only before initialization.  \n\n3. Lines 33\u201337, `function Initialized()`  \n   \u2022 Purpose: Flip the `intitalized` flag to `true`, preventing further configuration.  \n   \u2022 Access: Public, no restrictions other than no other logic.  \n\n4. Lines 39\u201345, `function Deposit()`  \n   \u2022 Purpose: Accept ETH, credit the sender\u2019s balance, then call `Log.AddMessage(...)` to record the deposit.  \n   \u2022 Relations: Invokes `Log.AddMessage` on the external `LogFile` contract.  \n\n5. Lines 47\u201359, `function Collect(uint _am)`  \n   \u2022 Purpose: If the caller\u2019s balance \u2265 MinSum and \u2265 the requested amount `_am`, send them `_am` ETH, deduct it from their balance, then log via `Log.AddMessage`.  \n   \u2022 Relations:  \n     - Low\u2010level call `msg.sender.call.value(_am)()` to transfer ETH.  \n     - On successful transfer, updates internal state (`balances[msg.sender] -= _am;`) and then calls `Log.AddMessage`.  \n\n6. Lines 62\u201367, `function() public payable` (fallback)  \n   \u2022 Purpose: Redirect any plain ETH transfers to the `Deposit()` function.  \n\n7. Lines 85\u201393, `function AddMessage(address _adr,uint _val,string _data)` (in `LogFile`)  \n   \u2022 Purpose: Populate a `Message` struct, timestamp it with `now`, then push it into the public `History` array.  \n\nPart 3 \u2013 DASP Top 10 Vulnerability Assessment  \nWe check each category and mark 1 (exists) or 0 (not found):\n\n- reentrancy: 1  \n  \u2022 Collect (lines 54\u201357) performs an external call to `msg.sender` before updating the balance. A malicious contract can reenter `Collect` and drain funds.  \n\n- access_control: 1  \n  \u2022 `SetMinSum`, `SetLogFile`, and `Initialized` are all `public` with no owner or role check. Any attacker can configure or lock the contract.  \n\n- arithmetic: 0  \n  \u2022 There are no unchecked overflows in subtraction or addition for practical balances, and pre\u2010checks prevent underflow on withdrawal.  \n\n- unchecked_low_level_calls: 0  \n  \u2022 The low\u2010level `.call.value` is checked by `if (...)` and only on success does state change occur.  \n\n- denial_of_service: 1  \n  \u2022 Because the vault calls the external `Log.AddMessage` after the transfer, a malicious or buggy `LogFile` contract can revert in `AddMessage`, causing the entire `Collect` to revert (undoing even successful ETH sends).  \n\n- bad_randomness: 0  \n  \u2022 No randomness used.  \n\n- front_running: 0  \n  \u2022 No manipulable pending\u2010transaction logic.  \n\n- time_manipulation: 0  \n  \u2022 `now` is only used for logging timestamps. No dependent logic.  \n\n- short_addresses: 0  \n  \u2022 Not applicable under Solidity \u22650.4.19.  \n\n- other: 0  \n\nSummary:  \n{  \n  reentrancy: 1,  \n  access_control: 1,  \n  arithmetic: 0,  \n  unchecked_low_level_calls: 0,  \n  denial_of_service: 1,  \n  bad_randomness: 0,  \n  front_running: 0,  \n  time_manipulation: 0,  \n  short_addresses: 0,  \n  other: 0  \n}\n\nPart 4 \u2013 Detailed Findings in JSON  \n```json\n[\n  {\n    \"category\": \"reentrancy\",\n    \"title\": \"External call before state update in Collect allows reentrancy\",\n    \"evidence\": {\n      \"file\": \"PRIVATE_ETH_CELL.sol\",\n      \"lines\": [54, 56],\n      \"function\": \"Collect\"\n    },\n    \"explanation\": \"The contract calls msg.sender.call.value(_am)() before decrementing balances[msg.sender]. A malicious contract can reenter Collect in its fallback and repeatedly drain funds until the vault is empty.\",\n    \"influence_scope\": {\n      \"functions\": [\"Collect\"],\n      \"lines\": [54, 56]\n    }\n  },\n  {\n    \"category\": \"access_control\",\n    \"title\": \"No ownership check on initialization functions\",\n    \"evidence\": {\n      \"file\": \"PRIVATE_ETH_CELL.sol\",\n      \"lines\": [19, 26, 33],\n      \"function\": \"SetMinSum / SetLogFile / Initialized\"\n    },\n    \"explanation\": \"All three configuration functions are public and only gated by a boolean flag. Any user can call SetMinSum, SetLogFile or Initialized to maliciously reconfigure or freeze the contract.\",\n    \"influence_scope\": {\n      \"functions\": [\"SetMinSum\", \"SetLogFile\", \"Initialized\"],\n      \"lines\": [19, 26, 33]\n    }\n  },\n  {\n    \"category\": \"denial_of_service\",\n    \"title\": \"Dependency on external LogFile for successful Collect\",\n    \"evidence\": {\n      \"file\": \"PRIVATE_ETH_CELL.sol\",\n      \"lines\": [57],\n      \"function\": \"Collect\"\n    },\n    \"explanation\": \"After transferring ETH, Collect calls Log.AddMessage. If the external LogFile contract reverts or runs out of gas, the entire Collect transaction reverts (including the ETH transfer), effectively blocking withdrawals.\",\n    \"influence_scope\": {\n      \"functions\": [\"Collect\", \"Deposit\"],\n      \"lines\": [44, 57]\n    }\n  }\n]\n```",
    "rendered_prompt": "You are a smart contract analyzer. You need to fully read the smart contracts code that I provide you later and understand and also carefully consider the inner logics of functions, explain the function call relationship, and the role of the call. There is no need to explain ERC20, ERC721, ERC777 function, and also function variable naming convention and other information. After that, you need to lead me to fully understand them.\n\nResponse requirements:\nDivide the analysis into three parts. You are required to strictly follow the steps of first, second and third part to think step by step when giving responses.\n\nIn the first part: introduce the project background, what tasks the contracts are executing, and the goals they aim to achieve.\n\nIn the second part: identify the function locations by line number, the purpose of each function, and whether there are any call relationships. If there are, explain how the functions are called and the purpose of these calls.\n\nIn the third part: You should further audit the above file. Here are the DASP Top 10 vulnerability categories: {reentrancy, access_control, arithmetic, unchecked_low_level_calls, denial_of_service, bad_randomness, front_running, time_manipulation, short_addresses, other}. You need to combine the context and comprehensive analysis to detect whether there are the mentioned vulnerabilities in smart contracts. If it exists, answer 1. Otherwise, answer 0 such as {reentrancy: 1, ..., other: 0}. Moreover, you need to locate these vulnerabilities in smart contracts and show me the code snippets that have these vulnerabilities, such as {function withdraw {...}} and show the scope of vulnerabilities' influence {what functions and what lines of code are influenced}.\n\nIn the fourth part: After completing the analysis above, compile your findings into a JSON array for systematic processing:\n\n```json\n[\n  {\n    \"category\": \"DASP category (reentrancy, access_control, arithmetic, etc.)\",\n    \"title\": \"Brief vulnerability title\",\n    \"evidence\": {\n      \"file\": \"filename.sol\",\n      \"lines\": [line_numbers],\n      \"function\": \"functionName\"\n    },\n    \"explanation\": \"Detailed explanation of the vulnerability and how it could be exploited\",\n    \"influence_scope\": {\n      \"functions\": [\"list\", \"of\", \"affected\", \"functions\"],\n      \"lines\": [list, of, affected, lines]\n    }\n  }\n]\n```\n\nReturn [] if no vulnerabilities are found after completing the full analysis.\n\n---\n\n## CONTRACT TO AUDIT:\n```solidity\n/*\n * @source: etherscan.io \n * @author: -\n \n */\n\npragma solidity ^0.4.19;\n\ncontract PRIVATE_ETH_CELL\n{\n    mapping (address=>uint256) public balances;   \n   \n    uint public MinSum;\n    \n    LogFile Log;\n    \n    bool intitalized;\n    \n    function SetMinSum(uint _val)\n    public\n    {\n        require(!intitalized);\n        MinSum = _val;\n    }\n    \n    function SetLogFile(address _log)\n    public\n    {\n        require(!intitalized);\n        Log = LogFile(_log);\n    }\n    \n    function Initialized()\n    public\n    {\n        intitalized = true;\n    }\n    \n    function Deposit()\n    public\n    payable\n    {\n        balances[msg.sender]+= msg.value;\n        Log.AddMessage(msg.sender,msg.value,\"Put\");\n    }\n    \n    function Collect(uint _am)\n    public\n    payable\n    {\n        if(balances[msg.sender]>=MinSum && balances[msg.sender]>=_am)\n        {\n            \n            if(msg.sender.call.value(_am)())\n            {\n                balances[msg.sender]-=_am;\n                Log.AddMessage(msg.sender,_am,\"Collect\");\n            }\n        }\n    }\n    \n    function() \n    public \n    payable\n    {\n        Deposit();\n    }\n    \n}\n\ncontract LogFile\n{\n    struct Message\n    {\n        address Sender;\n        string  Data;\n        uint Val;\n        uint  Time;\n    }\n    \n    Message[] public History;\n    \n    Message LastMsg;\n    \n    function AddMessage(address _adr,uint _val,string _data)\n    public\n    {\n        LastMsg.Sender = _adr;\n        LastMsg.Time = now;\n        LastMsg.Val = _val;\n        LastMsg.Data = _data;\n        History.push(LastMsg);\n    }\n}\n```\n\nNow perform the complete analysis. Think step by step through each part before providing your final JSON output.",
    "api_calls": 1,
    "latency_s": 35.99570846557617,
    "prompt_tokens": 930,
    "completion_tokens": 4227,
    "total_tokens": 5157,
    "cost_usd": 0.019621800000000002
  }
}