{
  "findings": [
    {
      "title": "Missing onlyOwner on initTokenBank",
      "category": "access_control",
      "severity": "medium",
      "confidence": 0.5,
      "evidence": {
        "file": "TokenBank.sol",
        "lines": [
          47,
          48,
          49,
          50,
          51,
          52
        ],
        "function": "initTokenBank"
      },
      "explanation": "The initTokenBank function is public and unguarded by onlyOwner, allowing any caller to reset the redeclared owner variable and MinDeposit, disrupting intended administration.",
      "fix_suggestion": "",
      "key_variables": [],
      "key_statements": [],
      "scenario_matched": "",
      "property_verified": "",
      "static_check_type": "",
      "source": "",
      "static_confirmed": null,
      "static_check_reason": ""
    },
    {
      "title": "Owner variable shadowing",
      "category": "access_control",
      "severity": "medium",
      "confidence": 0.5,
      "evidence": {
        "file": "TokenBank.sol",
        "lines": [
          32
        ],
        "function": "Token (state declaration)"
      },
      "explanation": "The Token contract redeclares `address owner`, shadowing the Ownable.owner variable. This confusion can lead to unintended behavior in ownership checks and state updates.",
      "fix_suggestion": "",
      "key_variables": [],
      "key_statements": [],
      "scenario_matched": "",
      "property_verified": "",
      "static_check_type": "",
      "source": "",
      "static_confirmed": null,
      "static_check_reason": ""
    },
    {
      "title": "Unchecked balance arithmetic",
      "category": "arithmetic",
      "severity": "medium",
      "confidence": 0.5,
      "evidence": {
        "file": "TokenBank.sol",
        "lines": [
          65,
          90
        ],
        "function": "Deposit (line 65), WithdrawToHolder (line 90)"
      },
      "explanation": "Balance updates use raw `+=` and `-=` without SafeMath. Deposit may overflow; WithdrawToHolder may underflow if _wei exceeds the stored balance.",
      "fix_suggestion": "",
      "key_variables": [],
      "key_statements": [],
      "scenario_matched": "",
      "property_verified": "",
      "static_check_type": "",
      "source": "",
      "static_confirmed": null,
      "static_check_reason": ""
    },
    {
      "title": "Low-level calls without proper checks",
      "category": "unchecked_low_level_calls",
      "severity": "medium",
      "confidence": 0.5,
      "evidence": {
        "file": "TokenBank.sol",
        "lines": [
          37,
          88
        ],
        "function": "WithdrawToken (line 37), WithdrawToHolder (line 88)"
      },
      "explanation": "Calls to external contracts (`token.call(...)` and `_addr.call.value(...)()`) ignore or only weakly handle the boolean return, leading to silent failures or inconsistent state.",
      "fix_suggestion": "",
      "key_variables": [],
      "key_statements": [],
      "scenario_matched": "",
      "property_verified": "",
      "static_check_type": "",
      "source": "",
      "static_confirmed": null,
      "static_check_reason": ""
    },
    {
      "title": "Soft access check in onlyOwner",
      "category": "other",
      "severity": "medium",
      "confidence": 0.5,
      "evidence": {
        "file": "TokenBank.sol",
        "lines": [
          24,
          26
        ],
        "function": "onlyOwner"
      },
      "explanation": "The onlyOwner modifier uses `if(owner == msg.sender) _;` with no revert on failure. Unauthorized calls simply do nothing instead of reverting, which can lead to unexpected behavior for callers expecting a revert on bad auth.",
      "fix_suggestion": "",
      "key_variables": [],
      "key_statements": [],
      "scenario_matched": "",
      "property_verified": "",
      "static_check_type": "",
      "source": "",
      "static_confirmed": null,
      "static_check_reason": ""
    }
  ],
  "parse_errors": [],
  "finding_count": 5,
  "ground_truth": [
    {
      "category": "reentrancy",
      "lines": [
        94
      ],
      "title": "Reentrancy"
    }
  ],
  "metrics": {
    "category_metrics": {
      "precision": 0.0,
      "recall": 0.0,
      "f1": 0.0,
      "tp": 0,
      "fp": 4,
      "fn": 1,
      "pred_categories": [
        "unchecked_low_level_calls",
        "access_control",
        "arithmetic",
        "other"
      ],
      "gt_categories": [
        "reentrancy"
      ],
      "matched_categories": [],
      "missed_categories": [
        "reentrancy"
      ],
      "spurious_categories": [
        "arithmetic",
        "access_control",
        "unchecked_low_level_calls",
        "other"
      ],
      "unknown_predictions": 0
    },
    "instance_metrics": {
      "precision": 0.0,
      "recall": 0.0,
      "f1": 0.0,
      "tp": 0,
      "fp": 5,
      "fn": 1,
      "matched_instances": [],
      "unmatched_predictions": [
        {
          "category": "access_control",
          "lines": [
            47,
            48,
            49,
            50,
            51,
            52
          ],
          "title": "Missing onlyOwner on initTokenBank"
        },
        {
          "category": "access_control",
          "lines": [
            32
          ],
          "title": "Owner variable shadowing"
        },
        {
          "category": "arithmetic",
          "lines": [
            65,
            90
          ],
          "title": "Unchecked balance arithmetic"
        },
        {
          "category": "unchecked_low_level_calls",
          "lines": [
            88,
            37
          ],
          "title": "Low-level calls without proper checks"
        },
        {
          "category": "other",
          "lines": [
            24,
            26
          ],
          "title": "Soft access check in onlyOwner"
        }
      ],
      "unmatched_ground_truth": [
        {
          "category": "reentrancy",
          "lines": [
            94
          ]
        }
      ],
      "has_line_annotations": true
    },
    "precision": 0.0,
    "recall": 0.0,
    "f1": 0.0,
    "tp": 0,
    "fp": 4,
    "fn": 1,
    "pred_categories": [
      "unchecked_low_level_calls",
      "access_control",
      "arithmetic",
      "other"
    ],
    "gt_categories": [
      "reentrancy"
    ],
    "matched_categories": [],
    "missed_categories": [
      "reentrancy"
    ],
    "spurious_categories": [
      "arithmetic",
      "access_control",
      "unchecked_low_level_calls",
      "other"
    ],
    "unknown_predictions": 0
  },
  "loc": {
    "loc_total": 100,
    "loc_code": 81,
    "loc_comments": 5,
    "loc_blank": 14
  },
  "runner_metadata": {
    "parse_errors": [],
    "raw_output": "Part 1 \u2013 Project Background  \nThe provided source implements a simple \u201ctoken bank\u201d on Ethereum. Its goals are:  \n\u2022 Allow users to deposit Ether into the bank (must deposit more than a minimum).  \n\u2022 Track each depositor\u2019s balance on\u2010chain.  \n\u2022 Let the contract owner send ERC-20 tokens or Ether from the bank to individual depositors.  \n\u2022 Support a two\u2010step ownership transfer (changeOwner + confirmOwner).  \n\nThere are three contracts:  \n1) Ownable: base contract that tracks an owner and allows a two\u2010step transfer.  \n2) Token: extends Ownable, adds a function to call transfer on an arbitrary token contract.  \n3) TokenBank: extends Token, lets anyone deposit Ether, and the owner withdraw tokens or Ether to depositors.\n\nPart 2 \u2013 Function List and Call Relationships  \nBelow are the functions (with approximate line numbers) and what each does.  \u201cOnlyOwner\u201d means guarded by the modifier at line 24\u201327.\n\n 1) changeOwner (lines 8\u201313)  \n    \u2013 onlyOwner. Sets the pending newOwner.  \n 2) confirmOwner (15\u201322)  \n    \u2013 Public. If msg.sender == newOwner, makes it the real owner.  \n 3) modifier onlyOwner (24\u201327)  \n    \u2013 Checks if msg.sender == owner (Ownable.owner); if not, skips the function body (no revert).  \n 4) WithdrawToken (lines 33\u201338)  \n    \u2013 onlyOwner. Low-level calls token.transfer(to, amount).  \n    \u2013 In TokenBank, WithdrawToken is invoked by:  \n      \u2022 WithdrawTokenToHolder \u2192 WithdrawToken (line 76)  \n 5) initTokenBank (47\u201352)  \n    \u2013 Public constructor\u2013style initializer. Sets owner = msg.sender and MinDeposit = 1 ether.  \n    \u2013 Note: no onlyOwner guard.  \n 6) fallback (54\u201358)  \n    \u2013 payable. Calls Deposit().  \n 7) Deposit (60\u201367)  \n    \u2013 payable. If msg.value > MinDeposit, increments Holders[msg.sender] by msg.value.  \n 8) WitdrawTokenToHolder (69\u201378)  \n    \u2013 onlyOwner. If the chosen holder has a balance > 0, zeroes it and calls WithdrawToken.  \n 9) WithdrawToHolder (80\u201393)  \n    \u2013 onlyOwner. If the chosen holder has a positive balance, sends them _wei in Ether via low-level .call().  \n      On success (call returns true), decrements their on-chain balance by _wei.  \n\nCall graph highlights:  \n\u2013 Fallback \u2192 Deposit  \n\u2013 WitdrawTokenToHolder \u2192 WithdrawToken  \n\u2013 WithdrawToHolder \u2192 low\u2010level Ether send to holder  \n\nPart 3 \u2013 DASP Top-10 Vulnerability Audit  \nWe categorize and locate each potential issue below:\n\n1) reentrancy: 0  \n   \u2013 All external calls are initiated only by the contract owner, and mapping updates either precede or guard re-entry properly.  \n\n2) access_control: 1  \n   \u2013 initTokenBank is public and lacks onlyOwner (lines 47\u201352). Anyone can call it and reset the redeclared owner variable and MinDeposit.  \n   \u2013 Also, Token redeclares `address owner` (line 32), shadowing Ownable.owner, leading to confusion in which owner is checked.  \n\n3) arithmetic: 1  \n   \u2013 No SafeMath.  \n     \u2022 Deposit: Holders[msg.sender] += msg.value (line 65). Potential overflow.  \n     \u2022 WithdrawToHolder: Holders[_addr] -= _wei (line 90) can underflow if _wei > stored balance (only a zero\u2010check is done).  \n\n4) unchecked_low_level_calls: 1  \n   \u2013 WithdrawToken uses `token.call(...)` (line 37) without checking the boolean return.  \n   \u2013 WithdrawToHolder uses `_addr.call.value(_wei)()` (line 88) and only branches on returned bool\u2014no revert on failure.  \n\n5) denial_of_service: 0  \n6) bad_randomness: 0  \n7) front_running: 0  \n8) time_manipulation: 0  \n9) short_addresses: 0  \n10) other: 1  \n   \u2013 Variable shadowing: redeclaration of `owner` in Token (line 32) hides the parent\u2019s owner variable, breaking intended access control.\n\nPart 4 \u2013 Findings in JSON  \n\n```json\n[\n  {\n    \"category\": \"access_control\",\n    \"title\": \"Missing onlyOwner on initTokenBank\",\n    \"evidence\": {\n      \"file\": \"TokenBank.sol\",\n      \"lines\": [47, 48, 49, 50, 51, 52],\n      \"function\": \"initTokenBank\"\n    },\n    \"explanation\": \"The initTokenBank function is public and unguarded by onlyOwner, allowing any caller to reset the redeclared owner variable and MinDeposit, disrupting intended administration.\",\n    \"influence_scope\": {\n      \"functions\": [\"initTokenBank\"],\n      \"lines\": [47, 48, 49, 50, 51, 52]\n    }\n  },\n  {\n    \"category\": \"access_control\",\n    \"title\": \"Owner variable shadowing\",\n    \"evidence\": {\n      \"file\": \"TokenBank.sol\",\n      \"lines\": [32],\n      \"function\": \"Token (state declaration)\"\n    },\n    \"explanation\": \"The Token contract redeclares `address owner`, shadowing the Ownable.owner variable. This confusion can lead to unintended behavior in ownership checks and state updates.\",\n    \"influence_scope\": {\n      \"functions\": [\"WithdrawToken\", \"initTokenBank\", \"WitdrawTokenToHolder\", \"WithdrawToHolder\"],\n      \"lines\": [32, 37, 50, 76, 88]\n    }\n  },\n  {\n    \"category\": \"arithmetic\",\n    \"title\": \"Unchecked balance arithmetic\",\n    \"evidence\": {\n      \"file\": \"TokenBank.sol\",\n      \"lines\": [65, 90],\n      \"function\": \"Deposit (line 65), WithdrawToHolder (line 90)\"\n    },\n    \"explanation\": \"Balance updates use raw `+=` and `-=` without SafeMath. Deposit may overflow; WithdrawToHolder may underflow if _wei exceeds the stored balance.\",\n    \"influence_scope\": {\n      \"functions\": [\"Deposit\", \"WithdrawToHolder\"],\n      \"lines\": [65, 90]\n    }\n  },\n  {\n    \"category\": \"unchecked_low_level_calls\",\n    \"title\": \"Low-level calls without proper checks\",\n    \"evidence\": {\n      \"file\": \"TokenBank.sol\",\n      \"lines\": [37, 88],\n      \"function\": \"WithdrawToken (line 37), WithdrawToHolder (line 88)\"\n    },\n    \"explanation\": \"Calls to external contracts (`token.call(...)` and `_addr.call.value(...)()`) ignore or only weakly handle the boolean return, leading to silent failures or inconsistent state.\",\n    \"influence_scope\": {\n      \"functions\": [\"WithdrawToken\", \"WithdrawToHolder\"],\n      \"lines\": [37, 88]\n    }\n  },\n  {\n    \"category\": \"other\",\n    \"title\": \"Soft access check in onlyOwner\",\n    \"evidence\": {\n      \"file\": \"TokenBank.sol\",\n      \"lines\": [24, 26],\n      \"function\": \"onlyOwner\"\n    },\n    \"explanation\": \"The onlyOwner modifier uses `if(owner == msg.sender) _;` with no revert on failure. Unauthorized calls simply do nothing instead of reverting, which can lead to unexpected behavior for callers expecting a revert on bad auth.\",\n    \"influence_scope\": {\n      \"functions\": [\"changeOwner\", \"WithdrawToken\", \"WitdrawTokenToHolder\", \"WithdrawToHolder\"],\n      \"lines\": [8, 11, 33, 36, 71, 88]\n    }\n  }\n]\n```",
    "rendered_prompt": "You are a smart contract analyzer. You need to fully read the smart contracts code that I provide you later and understand and also carefully consider the inner logics of functions, explain the function call relationship, and the role of the call. There is no need to explain ERC20, ERC721, ERC777 function, and also function variable naming convention and other information. After that, you need to lead me to fully understand them.\n\nResponse requirements:\nDivide the analysis into three parts. You are required to strictly follow the steps of first, second and third part to think step by step when giving responses.\n\nIn the first part: introduce the project background, what tasks the contracts are executing, and the goals they aim to achieve.\n\nIn the second part: identify the function locations by line number, the purpose of each function, and whether there are any call relationships. If there are, explain how the functions are called and the purpose of these calls.\n\nIn the third part: You should further audit the above file. Here are the DASP Top 10 vulnerability categories: {reentrancy, access_control, arithmetic, unchecked_low_level_calls, denial_of_service, bad_randomness, front_running, time_manipulation, short_addresses, other}. You need to combine the context and comprehensive analysis to detect whether there are the mentioned vulnerabilities in smart contracts. If it exists, answer 1. Otherwise, answer 0 such as {reentrancy: 1, ..., other: 0}. Moreover, you need to locate these vulnerabilities in smart contracts and show me the code snippets that have these vulnerabilities, such as {function withdraw {...}} and show the scope of vulnerabilities' influence {what functions and what lines of code are influenced}.\n\nIn the fourth part: After completing the analysis above, compile your findings into a JSON array for systematic processing:\n\n```json\n[\n  {\n    \"category\": \"DASP category (reentrancy, access_control, arithmetic, etc.)\",\n    \"title\": \"Brief vulnerability title\",\n    \"evidence\": {\n      \"file\": \"filename.sol\",\n      \"lines\": [line_numbers],\n      \"function\": \"functionName\"\n    },\n    \"explanation\": \"Detailed explanation of the vulnerability and how it could be exploited\",\n    \"influence_scope\": {\n      \"functions\": [\"list\", \"of\", \"affected\", \"functions\"],\n      \"lines\": [list, of, affected, lines]\n    }\n  }\n]\n```\n\nReturn [] if no vulnerabilities are found after completing the full analysis.\n\n---\n\n## CONTRACT TO AUDIT:\n```solidity\n/*\n * @source: etherscan.io \n * @author: -\n \n */\n\npragma solidity ^0.4.19;\n\ncontract Ownable\n{\n    address newOwner;\n    address owner = msg.sender;\n    \n    function changeOwner(address addr)\n    public\n    onlyOwner\n    {\n        newOwner = addr;\n    }\n    \n    function confirmOwner() \n    public\n    {\n        if(msg.sender==newOwner)\n        {\n            owner=newOwner;\n        }\n    }\n    \n    modifier onlyOwner\n    {\n        if(owner == msg.sender)_;\n    }\n}\n\ncontract Token is Ownable\n{\n    address owner = msg.sender;\n    function WithdrawToken(address token, uint256 amount,address to)\n    public \n    onlyOwner\n    {\n        token.call(bytes4(sha3(\"transfer(address,uint256)\")),to,amount); \n    }\n}\n\ncontract TokenBank is Token\n{\n    uint public MinDeposit;\n    mapping (address => uint) public Holders;\n    \n     ///Constructor\n    function initTokenBank()\n    public\n    {\n        owner = msg.sender;\n        MinDeposit = 1 ether;\n    }\n    \n    function()\n    payable\n    {\n        Deposit();\n    }\n   \n    function Deposit() \n    payable\n    {\n        if(msg.value>MinDeposit)\n        {\n            Holders[msg.sender]+=msg.value;\n        }\n    }\n    \n    function WitdrawTokenToHolder(address _to,address _token,uint _amount)\n    public\n    onlyOwner\n    {\n        if(Holders[_to]>0)\n        {\n            Holders[_to]=0;\n            WithdrawToken(_token,_amount,_to);     \n        }\n    }\n   \n    function WithdrawToHolder(address _addr, uint _wei) \n    public\n    onlyOwner\n    payable\n    {\n        if(Holders[_addr]>0)\n        {\n            \n            if(_addr.call.value(_wei)())\n            {\n                Holders[_addr]-=_wei;\n            }\n        }\n    }\n}\n```\n\nNow perform the complete analysis. Think step by step through each part before providing your final JSON output.",
    "api_calls": 1,
    "latency_s": 67.34751558303833,
    "prompt_tokens": 959,
    "completion_tokens": 7346,
    "total_tokens": 8305,
    "cost_usd": 0.0333773
  }
}