{
  "findings": [
    {
      "title": "Public proxy() and improper withdrawal permissions",
      "category": "access_control",
      "severity": "medium",
      "confidence": 0.5,
      "evidence": {
        "file": "VaultProxy.sol",
        "lines": [
          16,
          17,
          40,
          41,
          42
        ],
        "function": "proxy; withdraw"
      },
      "explanation": "The proxy() function (L16\u201318) is public and lets any caller forward ETH and calldata arbitrarily. The withdraw() function (L40\u201344) is restricted to the Proxy.Owner (not the VaultProxy.Owner), so depositors can never withdraw their own funds.",
      "fix_suggestion": "",
      "key_variables": [],
      "key_statements": [],
      "scenario_matched": "",
      "property_verified": "",
      "static_check_type": "",
      "source": "",
      "static_confirmed": null,
      "static_check_reason": ""
    },
    {
      "title": "Unchecked addition in deposit",
      "category": "arithmetic",
      "severity": "medium",
      "confidence": 0.5,
      "evidence": {
        "file": "VaultProxy.sol",
        "lines": [
          36
        ],
        "function": "deposit"
      },
      "explanation": "The line Deposits[msg.sender] += msg.value (L36) performs unchecked addition of uint256. Repeated or large deposits could overflow the balance counter.",
      "fix_suggestion": "",
      "key_variables": [],
      "key_statements": [],
      "scenario_matched": "",
      "property_verified": "",
      "static_check_type": "",
      "source": "",
      "static_confirmed": null,
      "static_check_reason": ""
    },
    {
      "title": "Unchecked call.value in proxy",
      "category": "unchecked_low_level_calls",
      "severity": "medium",
      "confidence": 0.5,
      "evidence": {
        "file": "VaultProxy.sol",
        "lines": [
          17
        ],
        "function": "proxy"
      },
      "explanation": "The low\u2010level call target.call.value(msg.value)(data) (L17) does not check the returned success flag. Failures are silent, leading to potential lost ETH or unexpected state.",
      "fix_suggestion": "",
      "key_variables": [],
      "key_statements": [],
      "scenario_matched": "",
      "property_verified": "",
      "static_check_type": "",
      "source": "",
      "static_confirmed": null,
      "static_check_reason": ""
    },
    {
      "title": "Misnamed constructor and variable shadowing",
      "category": "other",
      "severity": "medium",
      "confidence": 0.5,
      "evidence": {
        "file": "VaultProxy.sol",
        "lines": [
          22,
          27
        ],
        "function": "Vault"
      },
      "explanation": "Vault() (L27\u201332) was intended as a constructor but is a normal public function. Anyone can call it to reset VaultProxy.Owner. Additionally, VaultProxy redeclares Owner at L22, shadowing Proxy.Owner and causing unpredictability in access checks.",
      "fix_suggestion": "",
      "key_variables": [],
      "key_statements": [],
      "scenario_matched": "",
      "property_verified": "",
      "static_check_type": "",
      "source": "",
      "static_confirmed": null,
      "static_check_reason": ""
    }
  ],
  "parse_errors": [],
  "finding_count": 4,
  "ground_truth": [
    {
      "category": "unchecked_low_level_calls",
      "lines": [
        14
      ],
      "title": "Unchecked Return Values"
    }
  ],
  "metrics": {
    "category_metrics": {
      "precision": 0.25,
      "recall": 1.0,
      "f1": 0.4,
      "tp": 1,
      "fp": 3,
      "fn": 0,
      "pred_categories": [
        "arithmetic",
        "access_control",
        "unchecked_low_level_calls",
        "other"
      ],
      "gt_categories": [
        "unchecked_low_level_calls"
      ],
      "matched_categories": [
        "unchecked_low_level_calls"
      ],
      "missed_categories": [],
      "spurious_categories": [
        "access_control",
        "arithmetic",
        "other"
      ],
      "unknown_predictions": 0
    },
    "instance_metrics": {
      "precision": 0.25,
      "recall": 1.0,
      "f1": 0.4,
      "tp": 1,
      "fp": 3,
      "fn": 0,
      "matched_instances": [
        {
          "category": "unchecked_low_level_calls",
          "pred_lines": [
            17
          ],
          "gt_lines": [
            14
          ],
          "function": "proxy"
        }
      ],
      "unmatched_predictions": [
        {
          "category": "access_control",
          "lines": [
            40,
            41,
            42,
            16,
            17
          ],
          "title": "Public proxy() and improper withdrawal permissions"
        },
        {
          "category": "arithmetic",
          "lines": [
            36
          ],
          "title": "Unchecked addition in deposit"
        },
        {
          "category": "other",
          "lines": [
            27,
            22
          ],
          "title": "Misnamed constructor and variable shadowing"
        }
      ],
      "unmatched_ground_truth": [],
      "has_line_annotations": true
    },
    "precision": 0.25,
    "recall": 1.0,
    "f1": 0.4,
    "tp": 1,
    "fp": 3,
    "fn": 0,
    "pred_categories": [
      "arithmetic",
      "access_control",
      "unchecked_low_level_calls",
      "other"
    ],
    "gt_categories": [
      "unchecked_low_level_calls"
    ],
    "matched_categories": [
      "unchecked_low_level_calls"
    ],
    "missed_categories": [],
    "spurious_categories": [
      "access_control",
      "arithmetic",
      "other"
    ],
    "unknown_predictions": 0
  },
  "loc": {
    "loc_total": 42,
    "loc_code": 29,
    "loc_comments": 4,
    "loc_blank": 9
  },
  "runner_metadata": {
    "parse_errors": [],
    "raw_output": "Part 1 \u2013 Project Background  \nThe provided code defines a simple forwarding proxy (Proxy) and a \u201cvault\u201d on top of it (VaultProxy).  \n\u2022 Proxy\u2019s role is to hold an owner address, allow ownership transfers, and forward arbitrary calls (and ETH) to any target contract.  \n\u2022 VaultProxy inherits Proxy, exposes its own Owner field (shadowing the parent\u2019s), lets anyone deposit more than 0.5 ETH, and only allows the Proxy owner to withdraw deposited funds.  \nThe intended goal seems to be: users deposit ETH into the vault, then the vault owner can manage or refund those deposits. In practice, due to logic flaws, users cannot withdraw, and the vault owner (the deployer of Proxy) can sweep everything at will.  \n\nPart 2 \u2013 Function Breakdown and Call Relationships  \n(Note: line numbers refer to the annotated listing below.)\n\n 10  pragma solidity ^0.4.24;\n 11  \n 12  contract Proxy  {\n 13      modifier onlyOwner { if (msg.sender == Owner) _; }                              // L13\u201314\n 14      address Owner = msg.sender;                                                     // L14\n 15      function transferOwner(address _owner) public onlyOwner { Owner = _owner; }    // L15\n 16      function proxy(address target, bytes data) public payable {                     // L16\n 17          target.call.value(msg.value)(data);                                        // L17\n 18      }                                                                              // L18\n 19  }\n 20  \n 21  contract VaultProxy is Proxy {\n 22      address public Owner;                                                          // L22 (shadows Proxy.Owner)\n 23      mapping (address => uint256) public Deposits;                                  // L23\n 24  \n 25      function () public payable { }                                                // L25\n 26      \n 27      function Vault() public payable {                                             // L27 (intended constructor but is a normal function)\n 28          if (msg.sender == tx.origin) {                                            // L28\n 29              Owner = msg.sender;                                                   // L29\n 30              deposit();                                                            // L30\n 31          }\n 32      }                                                                              // L32\n 33      \n 34      function deposit() public payable {                                           // L34\n 35          if (msg.value > 0.5 ether) {                                              // L35\n 36              Deposits[msg.sender] += msg.value;                                    // L36\n 37          }\n 38      }                                                                              // L38\n 39      \n 40      function withdraw(uint256 amount) public onlyOwner {                          // L40\n 41          if (amount>0 && Deposits[msg.sender]>=amount) {                           // L41\n 42              msg.sender.transfer(amount);                                         // L42\n 43          }\n 44      }                                                                              // L44\n 45  }\n\nFunction purposes and relationships  \n\u2013 Proxy.onlyOwner (L13\u201314): allows internal execution only when msg.sender equals Proxy.Owner.  \n\u2013 Proxy.transferOwner (L15): lets the current Proxy.Owner set a new owner.  \n\u2013 Proxy.proxy (L16\u201318): forwards ETH and calldata to any target; no access control, no return\u2010value checks.  \n\u2013 VaultProxy fallback (L25): payable but does nothing (any direct send goes here).  \n\u2013 VaultProxy.Vault (L27\u201332): not a constructor (wrong name), public. If called by an EOA, sets VaultProxy.Owner (the shadow variable) and calls deposit().  \n\u2013 VaultProxy.deposit (L34\u201338): accepts ETH > 0.5 and credits sender\u2019s Deposits mapping.  \n\u2013 VaultProxy.withdraw (L40\u201344): restricted by Proxy.onlyOwner (uses Proxy.Owner), lets the deployer/owner of Proxy withdraw up to the deposited amount for msg.sender. Because onlyProxy.Owner can call withdraw, ordinary depositors cannot reclaim their funds.  \n\nCall relationships  \n\u2022 Vault() \u2192 deposit() (L30)  \n\u2022 withdraw() uses onlyOwner modifier (L13\u201314)  \n\u2022 proxy() is standalone; no internal calls to other contract methods  \n\nPart 3 \u2013 DASP Top 10 Vulnerability Analysis  \nreentrancy: 0  \n  \u2013 withdraw uses transfer (2300 gas), no reentrant external calls, deposit has no external calls.  \n\naccess_control: 1  \n  \u2013 proxy() is public (L16\u201318), letting anyone forward arbitrary calls in the context of the contract.  \n  \u2013 withdraw() (L40\u201344) uses onlyOwner from the Proxy, so depositors can never withdraw their own deposits.  \n\narithmetic: 1  \n  \u2013 Deposits[msg.sender] += msg.value (L36) uses unchecked addition; large repeated deposits could overflow the uint256 counter.  \n\nunchecked_low_level_calls: 1  \n  \u2013 target.call.value(msg.value)(data) in proxy() (L17) does not check the return value; failures are silent and could lead to lost ETH or broken logic.  \n\ndenial_of_service: 0  \n  \u2013 no obvious single point allows permanent lockout of ETH flows aside from the access_control issue already covered.  \n\nbad_randomness: 0  \n  \u2013 no randomness.  \n\nfront_running: 0  \n  \u2013 no vulnerable ordering/priority logic.  \n\ntime_manipulation: 0  \n  \u2013 no timestamps or block numbers used.  \n\nshort_addresses: 0  \n  \u2013 no external calls vulnerable to short\u2010address attack pattern.  \n\nother: 1  \n  \u2013 misnamed \u201cconstructor\u201d Vault() (L27\u201332): this is a public function, not a constructor. Anyone can call it repeatedly to reset VaultProxy.Owner.  \n  \u2013 variable shadowing: VaultProxy redeclares Owner (L22), hiding Proxy.Owner. This obfuscates which owner variable controls withdraw() and transferOwner().  \n\nPart 4 \u2013 JSON Output  \n[\n  {\n    \"category\": \"access_control\",\n    \"title\": \"Public proxy() and improper withdrawal permissions\",\n    \"evidence\": {\n      \"file\": \"VaultProxy.sol\",\n      \"lines\": [16,17,40,41,42],\n      \"function\": \"proxy; withdraw\"\n    },\n    \"explanation\": \"The proxy() function (L16\u201318) is public and lets any caller forward ETH and calldata arbitrarily. The withdraw() function (L40\u201344) is restricted to the Proxy.Owner (not the VaultProxy.Owner), so depositors can never withdraw their own funds.\",\n    \"influence_scope\": {\n      \"functions\": [\"proxy\", \"withdraw\"],\n      \"lines\": [16,17,40,41,42]\n    }\n  },\n  {\n    \"category\": \"arithmetic\",\n    \"title\": \"Unchecked addition in deposit\",\n    \"evidence\": {\n      \"file\": \"VaultProxy.sol\",\n      \"lines\": [36],\n      \"function\": \"deposit\"\n    },\n    \"explanation\": \"The line Deposits[msg.sender] += msg.value (L36) performs unchecked addition of uint256. Repeated or large deposits could overflow the balance counter.\",\n    \"influence_scope\": {\n      \"functions\": [\"deposit\"],\n      \"lines\": [35,36]\n    }\n  },\n  {\n    \"category\": \"unchecked_low_level_calls\",\n    \"title\": \"Unchecked call.value in proxy\",\n    \"evidence\": {\n      \"file\": \"VaultProxy.sol\",\n      \"lines\": [17],\n      \"function\": \"proxy\"\n    },\n    \"explanation\": \"The low\u2010level call target.call.value(msg.value)(data) (L17) does not check the returned success flag. Failures are silent, leading to potential lost ETH or unexpected state.\",\n    \"influence_scope\": {\n      \"functions\": [\"proxy\"],\n      \"lines\": [16,17,18]\n    }\n  },\n  {\n    \"category\": \"other\",\n    \"title\": \"Misnamed constructor and variable shadowing\",\n    \"evidence\": {\n      \"file\": \"VaultProxy.sol\",\n      \"lines\": [22,27],\n      \"function\": \"Vault\"\n    },\n    \"explanation\": \"Vault() (L27\u201332) was intended as a constructor but is a normal public function. Anyone can call it to reset VaultProxy.Owner. Additionally, VaultProxy redeclares Owner at L22, shadowing Proxy.Owner and causing unpredictability in access checks.\",\n    \"influence_scope\": {\n      \"functions\": [\"Vault\"],\n      \"lines\": [22,27,28,29,30,31]\n    }\n  }\n]",
    "rendered_prompt": "You are a smart contract analyzer. You need to fully read the smart contracts code that I provide you later and understand and also carefully consider the inner logics of functions, explain the function call relationship, and the role of the call. There is no need to explain ERC20, ERC721, ERC777 function, and also function variable naming convention and other information. After that, you need to lead me to fully understand them.\n\nResponse requirements:\nDivide the analysis into three parts. You are required to strictly follow the steps of first, second and third part to think step by step when giving responses.\n\nIn the first part: introduce the project background, what tasks the contracts are executing, and the goals they aim to achieve.\n\nIn the second part: identify the function locations by line number, the purpose of each function, and whether there are any call relationships. If there are, explain how the functions are called and the purpose of these calls.\n\nIn the third part: You should further audit the above file. Here are the DASP Top 10 vulnerability categories: {reentrancy, access_control, arithmetic, unchecked_low_level_calls, denial_of_service, bad_randomness, front_running, time_manipulation, short_addresses, other}. You need to combine the context and comprehensive analysis to detect whether there are the mentioned vulnerabilities in smart contracts. If it exists, answer 1. Otherwise, answer 0 such as {reentrancy: 1, ..., other: 0}. Moreover, you need to locate these vulnerabilities in smart contracts and show me the code snippets that have these vulnerabilities, such as {function withdraw {...}} and show the scope of vulnerabilities' influence {what functions and what lines of code are influenced}.\n\nIn the fourth part: After completing the analysis above, compile your findings into a JSON array for systematic processing:\n\n```json\n[\n  {\n    \"category\": \"DASP category (reentrancy, access_control, arithmetic, etc.)\",\n    \"title\": \"Brief vulnerability title\",\n    \"evidence\": {\n      \"file\": \"filename.sol\",\n      \"lines\": [line_numbers],\n      \"function\": \"functionName\"\n    },\n    \"explanation\": \"Detailed explanation of the vulnerability and how it could be exploited\",\n    \"influence_scope\": {\n      \"functions\": [\"list\", \"of\", \"affected\", \"functions\"],\n      \"lines\": [list, of, affected, lines]\n    }\n  }\n]\n```\n\nReturn [] if no vulnerabilities are found after completing the full analysis.\n\n---\n\n## CONTRACT TO AUDIT:\n```solidity\n/*\n * @source: etherscan.io \n * @author: -\n \n */\n\npragma solidity ^0.4.24;\n\ncontract Proxy  {\n    modifier onlyOwner { if (msg.sender == Owner) _; } address Owner = msg.sender;\n    function transferOwner(address _owner) public onlyOwner { Owner = _owner; } \n    function proxy(address target, bytes data) public payable {\n        \n        target.call.value(msg.value)(data);\n    }\n}\n\ncontract VaultProxy is Proxy {\n    address public Owner;\n    mapping (address => uint256) public Deposits;\n\n    function () public payable { }\n    \n    function Vault() public payable {\n        if (msg.sender == tx.origin) {\n            Owner = msg.sender;\n            deposit();\n        }\n    }\n    \n    function deposit() public payable {\n        if (msg.value > 0.5 ether) {\n            Deposits[msg.sender] += msg.value;\n        }\n    }\n    \n    function withdraw(uint256 amount) public onlyOwner {\n        if (amount>0 && Deposits[msg.sender]>=amount) {\n            msg.sender.transfer(amount);\n        }\n    }\n}\n```\n\nNow perform the complete analysis. Think step by step through each part before providing your final JSON output.",
    "api_calls": 1,
    "latency_s": 82.15232110023499,
    "prompt_tokens": 779,
    "completion_tokens": 5700,
    "total_tokens": 6479,
    "cost_usd": 0.025936900000000002
  }
}