{
  "findings": [
    {
      "title": "Balance updated after external call",
      "category": "reentrancy",
      "severity": "medium",
      "confidence": 0.5,
      "evidence": {
        "file": "MONEY_BOX.sol",
        "lines": [
          63,
          65
        ],
        "function": "Collect"
      },
      "explanation": "In Collect, the contract calls msg.sender.call.value(_am)() before deducting _am from the user\u2019s stored balance. A malicious fallback can reenter Collect and withdraw multiple times.",
      "fix_suggestion": "",
      "key_variables": [],
      "key_statements": [],
      "scenario_matched": "",
      "property_verified": "",
      "static_check_type": "",
      "source": "",
      "static_confirmed": null,
      "static_check_reason": ""
    },
    {
      "title": "Unrestricted configuration functions",
      "category": "access_control",
      "severity": "medium",
      "confidence": 0.5,
      "evidence": {
        "file": "MONEY_BOX.sol",
        "lines": [
          25,
          26,
          27,
          28,
          29,
          30,
          32,
          33,
          34,
          35,
          36,
          37,
          39,
          40,
          41,
          42,
          43
        ],
        "function": "SetMinSum / SetLogFile / Initialized"
      },
      "explanation": "SetMinSum, SetLogFile, and Initialized are public with no onlyOwner or equivalent. Any user can call them to hijack parameters or lock the contract prematurely.",
      "fix_suggestion": "",
      "key_variables": [],
      "key_statements": [],
      "scenario_matched": "",
      "property_verified": "",
      "static_check_type": "",
      "source": "",
      "static_confirmed": null,
      "static_check_reason": ""
    },
    {
      "title": "Use of low-level call without proper checks",
      "category": "unchecked_low_level_calls",
      "severity": "medium",
      "confidence": 0.5,
      "evidence": {
        "file": "MONEY_BOX.sol",
        "lines": [
          63
        ],
        "function": "Collect"
      },
      "explanation": "The contract uses msg.sender.call.value(_am)(), a low-level call, which can succeed under unintended circumstances and complicates safety guarantees.",
      "fix_suggestion": "",
      "key_variables": [],
      "key_statements": [],
      "scenario_matched": "",
      "property_verified": "",
      "static_check_type": "",
      "source": "",
      "static_confirmed": null,
      "static_check_reason": ""
    },
    {
      "title": "Reliance on external log contract",
      "category": "denial_of_service",
      "severity": "medium",
      "confidence": 0.5,
      "evidence": {
        "file": "MONEY_BOX.sol",
        "lines": [
          52,
          66
        ],
        "function": "Put / Collect"
      },
      "explanation": "Both Put and Collect call LogFile.AddMessage. If the Log contract ever reverts or runs out of gas, deposits and withdrawals will fail, effectively disabling the money box.",
      "fix_suggestion": "",
      "key_variables": [],
      "key_statements": [],
      "scenario_matched": "",
      "property_verified": "",
      "static_check_type": "",
      "source": "",
      "static_confirmed": null,
      "static_check_reason": ""
    }
  ],
  "parse_errors": [],
  "finding_count": 4,
  "ground_truth": [
    {
      "category": "reentrancy",
      "lines": [
        63
      ],
      "title": "Reentrancy"
    }
  ],
  "metrics": {
    "category_metrics": {
      "precision": 0.25,
      "recall": 1.0,
      "f1": 0.4,
      "tp": 1,
      "fp": 3,
      "fn": 0,
      "pred_categories": [
        "reentrancy",
        "access_control",
        "unchecked_low_level_calls",
        "denial_of_service"
      ],
      "gt_categories": [
        "reentrancy"
      ],
      "matched_categories": [
        "reentrancy"
      ],
      "missed_categories": [],
      "spurious_categories": [
        "access_control",
        "unchecked_low_level_calls",
        "denial_of_service"
      ],
      "unknown_predictions": 0
    },
    "instance_metrics": {
      "precision": 0.25,
      "recall": 1.0,
      "f1": 0.4,
      "tp": 1,
      "fp": 3,
      "fn": 0,
      "matched_instances": [
        {
          "category": "reentrancy",
          "pred_lines": [
            65,
            63
          ],
          "gt_lines": [
            63
          ],
          "function": "Collect"
        }
      ],
      "unmatched_predictions": [
        {
          "category": "access_control",
          "lines": [
            32,
            33,
            34,
            35,
            36,
            37,
            39,
            40,
            41,
            42,
            43,
            25,
            26,
            27,
            28,
            29,
            30
          ],
          "title": "Unrestricted configuration functions"
        },
        {
          "category": "unchecked_low_level_calls",
          "lines": [
            63
          ],
          "title": "Use of low-level call without proper checks"
        },
        {
          "category": "denial_of_service",
          "lines": [
            66,
            52
          ],
          "title": "Reliance on external log contract"
        }
      ],
      "unmatched_ground_truth": [],
      "has_line_annotations": true
    },
    "precision": 0.25,
    "recall": 1.0,
    "f1": 0.4,
    "tp": 1,
    "fp": 3,
    "fn": 0,
    "pred_categories": [
      "reentrancy",
      "access_control",
      "unchecked_low_level_calls",
      "denial_of_service"
    ],
    "gt_categories": [
      "reentrancy"
    ],
    "matched_categories": [
      "reentrancy"
    ],
    "missed_categories": [],
    "spurious_categories": [
      "access_control",
      "unchecked_low_level_calls",
      "denial_of_service"
    ],
    "unknown_predictions": 0
  },
  "loc": {
    "loc_total": 103,
    "loc_code": 80,
    "loc_comments": 4,
    "loc_blank": 19
  },
  "runner_metadata": {
    "parse_errors": [],
    "raw_output": "Part 1: Project Background  \nThis pair of contracts implements a simple \u201ctime-locked money box\u201d with an external logging facility.  \n- MONEY_BOX lets any user deposit ether, set or extend a personal unlock time, and later withdraw (collect) funds once their unlock time has passed and their balance exceeds a minimum threshold.  \n- An external Log contract is used to record every deposit (\u201cPut\u201d) and withdrawal (\u201cCollect\u201d) event.  \n- The owner (in theory) should configure the minimum withdrawable sum and the address of the Log contract before \u201clocking\u201d those settings via an initialization flag.  \n\nPart 2: Function Overview and Call Relationships  \nLine numbers refer to the provided source:\n\n1. Lines 25\u201330: function SetMinSum(uint _val)  \n   \u2022 Purpose: configure the minimum balance (MinSum) required for withdrawals.  \n   \u2022 Access: public, gated only by the \u201cintitalized\u201d flag (throws if already initialized).  \n   \u2022 No external calls.  \n\n2. Lines 32\u201337: function SetLogFile(address _log)  \n   \u2022 Purpose: set the address of the external Log contract.  \n   \u2022 Access: public, gated only by the \u201cintitalized\u201d flag.  \n   \u2022 Converts the address to the Log type.  \n\n3. Lines 39\u201343: function Initialized()  \n   \u2022 Purpose: flip the \u201cintitalized\u201d flag to true, disabling further changes to MinSum or LogFile.  \n   \u2022 Access: public, no owner restriction.  \n\n4. Lines 45\u201353: function Put(uint _lockTime) payable  \n   \u2022 Purpose: deposit ether into the sender\u2019s account, extend unlockTime if the new lock is later, and log the action.  \n   \u2022 Key storage operations:  \n     \u2013 Acc[msg.sender].balance += msg.value  \n     \u2013 Acc[msg.sender].unlockTime = max(old, now+_lockTime)  \n   \u2022 External call: LogFile.AddMessage(msg.sender, msg.value, \"Put\")  \n\n5. Lines 55\u201369: function Collect(uint _am) payable  \n   \u2022 Purpose: allow a user to withdraw an amount `_am` of their balance if:  \n     \u2013 balance >= MinSum  \n     \u2013 balance >= _am  \n     \u2013 now > unlockTime  \n   \u2022 External call #1: msg.sender.call.value(_am)()  \n   \u2022 On success of that call, updates balance and logs via LogFile.AddMessage(msg.sender, _am, \"Collect\")  \n\n6. Lines 71\u201376: fallback function payable  \n   \u2022 Purpose: treat plain transfers as a Put(0) call, i.e., instant deposit without extending lock.  \n   \u2022 Delegates directly to Put(0).  \n\n7. Lines 94\u2013102: Log.AddMessage(address, uint, string)  \n   \u2022 Purpose: record a new Message struct in History[].  \n\nCall Relationships:  \n- Put and Collect both call the external Log contract to record events.  \n- The fallback function calls Put.  \n- Collect uses a low-level call to send ether back to the user, then continues execution to update state and call the logger.  \n\nPart 3: Vulnerability Audit (DASP Top 10)  \n\nreentrancy: 1  \n  - Location: Collect (lines 63\u201365)  \n  - Description: external call via `msg.sender.call.value(_am)()` happens before the user\u2019s balance is decremented. An attacker contract can reenter Collect and drain more than its balance.  \n\naccess_control: 1  \n  - Location: SetMinSum (25\u201330), SetLogFile (32\u201337), Initialized (39\u201343)  \n  - Description: these configuration functions are public with no ownership check. Any user can hijack the initial configuration or lock the contract prematurely.  \n\narithmetic: 0  \n  - No unchecked critical overflows/underflows lead to exploitable conditions (bounds in Collect ensure no underflow).  \n\nunchecked_low_level_calls: 1  \n  - Location: Collect at line 63  \n  - Description: usage of low-level `.call.value()` without proper reversion or gas control patterns.  \n\ndenial_of_service: 1  \n  - Location: Put line 52, Collect line 66  \n  - Description: both functions rely on the external Log contract\u2019s AddMessage. If the Log contract reverts or consumes excessive gas, deposits or logs on Collect will fail, blocking the core functionality.  \n\nbad_randomness: 0  \nfront_running: 0  \ntime_manipulation: 0  \nshort_addresses: 0  \nother: 0  \n\nPart 4: Findings in JSON  \n[  \n  {  \n    \"category\": \"reentrancy\",  \n    \"title\": \"Balance updated after external call\",  \n    \"evidence\": {  \n      \"file\": \"MONEY_BOX.sol\",  \n      \"lines\": [63, 65],  \n      \"function\": \"Collect\"  \n    },  \n    \"explanation\": \"In Collect, the contract calls msg.sender.call.value(_am)() before deducting _am from the user\u2019s stored balance. A malicious fallback can reenter Collect and withdraw multiple times.\",  \n    \"influence_scope\": {  \n      \"functions\": [\"Collect\"],  \n      \"lines\": [59, 69]  \n    }  \n  },  \n  {  \n    \"category\": \"access_control\",  \n    \"title\": \"Unrestricted configuration functions\",  \n    \"evidence\": {  \n      \"file\": \"MONEY_BOX.sol\",  \n      \"lines\": [25,26,27,28,29,30,32,33,34,35,36,37,39,40,41,42,43],  \n      \"function\": \"SetMinSum / SetLogFile / Initialized\"  \n    },  \n    \"explanation\": \"SetMinSum, SetLogFile, and Initialized are public with no onlyOwner or equivalent. Any user can call them to hijack parameters or lock the contract prematurely.\",  \n    \"influence_scope\": {  \n      \"functions\": [\"SetMinSum\",\"SetLogFile\",\"Initialized\"],  \n      \"lines\": [25, 43]  \n    }  \n  },  \n  {  \n    \"category\": \"unchecked_low_level_calls\",  \n    \"title\": \"Use of low-level call without proper checks\",  \n    \"evidence\": {  \n      \"file\": \"MONEY_BOX.sol\",  \n      \"lines\": [63],  \n      \"function\": \"Collect\"  \n    },  \n    \"explanation\": \"The contract uses msg.sender.call.value(_am)(), a low-level call, which can succeed under unintended circumstances and complicates safety guarantees.\",  \n    \"influence_scope\": {  \n      \"functions\": [\"Collect\"],  \n      \"lines\": [63]  \n    }  \n  },  \n  {  \n    \"category\": \"denial_of_service\",  \n    \"title\": \"Reliance on external log contract\",  \n    \"evidence\": {  \n      \"file\": \"MONEY_BOX.sol\",  \n      \"lines\": [52, 66],  \n      \"function\": \"Put / Collect\"  \n    },  \n    \"explanation\": \"Both Put and Collect call LogFile.AddMessage. If the Log contract ever reverts or runs out of gas, deposits and withdrawals will fail, effectively disabling the money box.\",  \n    \"influence_scope\": {  \n      \"functions\": [\"Put\",\"Collect\"],  \n      \"lines\": [49, 69]  \n    }  \n  }  \n]",
    "rendered_prompt": "You are a smart contract analyzer. You need to fully read the smart contracts code that I provide you later and understand and also carefully consider the inner logics of functions, explain the function call relationship, and the role of the call. There is no need to explain ERC20, ERC721, ERC777 function, and also function variable naming convention and other information. After that, you need to lead me to fully understand them.\n\nResponse requirements:\nDivide the analysis into three parts. You are required to strictly follow the steps of first, second and third part to think step by step when giving responses.\n\nIn the first part: introduce the project background, what tasks the contracts are executing, and the goals they aim to achieve.\n\nIn the second part: identify the function locations by line number, the purpose of each function, and whether there are any call relationships. If there are, explain how the functions are called and the purpose of these calls.\n\nIn the third part: You should further audit the above file. Here are the DASP Top 10 vulnerability categories: {reentrancy, access_control, arithmetic, unchecked_low_level_calls, denial_of_service, bad_randomness, front_running, time_manipulation, short_addresses, other}. You need to combine the context and comprehensive analysis to detect whether there are the mentioned vulnerabilities in smart contracts. If it exists, answer 1. Otherwise, answer 0 such as {reentrancy: 1, ..., other: 0}. Moreover, you need to locate these vulnerabilities in smart contracts and show me the code snippets that have these vulnerabilities, such as {function withdraw {...}} and show the scope of vulnerabilities' influence {what functions and what lines of code are influenced}.\n\nIn the fourth part: After completing the analysis above, compile your findings into a JSON array for systematic processing:\n\n```json\n[\n  {\n    \"category\": \"DASP category (reentrancy, access_control, arithmetic, etc.)\",\n    \"title\": \"Brief vulnerability title\",\n    \"evidence\": {\n      \"file\": \"filename.sol\",\n      \"lines\": [line_numbers],\n      \"function\": \"functionName\"\n    },\n    \"explanation\": \"Detailed explanation of the vulnerability and how it could be exploited\",\n    \"influence_scope\": {\n      \"functions\": [\"list\", \"of\", \"affected\", \"functions\"],\n      \"lines\": [list, of, affected, lines]\n    }\n  }\n]\n```\n\nReturn [] if no vulnerabilities are found after completing the full analysis.\n\n---\n\n## CONTRACT TO AUDIT:\n```solidity\n/*\n * @source: etherscan.io \n * @author: -\n \n */\n\npragma solidity ^0.4.19;\n\ncontract MONEY_BOX   \n{\n    struct Holder   \n    {\n        uint unlockTime;\n        uint balance;\n    }\n    \n    mapping (address => Holder) public Acc;\n    \n    uint public MinSum;\n    \n    Log LogFile;\n    \n    bool intitalized;\n    \n    function SetMinSum(uint _val)\n    public\n    {\n        if(intitalized)throw;\n        MinSum = _val;\n    }\n    \n    function SetLogFile(address _log)\n    public\n    {\n        if(intitalized)throw;\n        LogFile = Log(_log);\n    }\n    \n    function Initialized()\n    public\n    {\n        intitalized = true;\n    }\n    \n    function Put(uint _lockTime)\n    public\n    payable\n    {\n        var acc = Acc[msg.sender];\n        acc.balance += msg.value;\n        if(now+_lockTime>acc.unlockTime)acc.unlockTime=now+_lockTime;\n        LogFile.AddMessage(msg.sender,msg.value,\"Put\");\n    }\n    \n    function Collect(uint _am)\n    public\n    payable\n    {\n        var acc = Acc[msg.sender];\n        if( acc.balance>=MinSum && acc.balance>=_am && now>acc.unlockTime)\n        {\n            \n            if(msg.sender.call.value(_am)())\n            {\n                acc.balance-=_am;\n                LogFile.AddMessage(msg.sender,_am,\"Collect\");\n            }\n        }\n    }\n    \n    function() \n    public \n    payable\n    {\n        Put(0);\n    }\n    \n}\n\ncontract Log \n{\n    struct Message\n    {\n        address Sender;\n        string  Data;\n        uint Val;\n        uint  Time;\n    }\n    \n    Message[] public History;\n    \n    Message LastMsg;\n    \n    function AddMessage(address _adr,uint _val,string _data)\n    public\n    {\n        LastMsg.Sender = _adr;\n        LastMsg.Time = now;\n        LastMsg.Val = _val;\n        LastMsg.Data = _data;\n        History.push(LastMsg);\n    }\n}\n```\n\nNow perform the complete analysis. Think step by step through each part before providing your final JSON output.",
    "api_calls": 1,
    "latency_s": 45.21595025062561,
    "prompt_tokens": 993,
    "completion_tokens": 4657,
    "total_tokens": 5650,
    "cost_usd": 0.0215831
  }
}