{
  "findings": [
    {
      "title": "Unchecked send return values",
      "category": "unchecked_low_level_calls",
      "severity": "medium",
      "confidence": 0.5,
      "evidence": {
        "file": "timestampdependent.sol",
        "lines": [
          9,
          12
        ],
        "function": "payOut"
      },
      "explanation": "The contract uses address.send(...) to transfer Ether but does not verify the Boolean return value. This can silently fail and leave the caller or leader unfunded without reverting.",
      "fix_suggestion": "",
      "key_variables": [],
      "key_statements": [],
      "scenario_matched": "",
      "property_verified": "",
      "static_check_type": "",
      "source": "",
      "static_confirmed": null,
      "static_check_reason": ""
    },
    {
      "title": "Potential DoS via failed send",
      "category": "denial_of_service",
      "severity": "medium",
      "confidence": 0.5,
      "evidence": {
        "file": "timestampdependent.sol",
        "lines": [
          12
        ],
        "function": "payOut"
      },
      "explanation": "If sending the contract balance to the leader fails (e.g., due to a malicious fallback or out\u2010of\u2010gas), funds remain stuck in the contract and no recovery path is provided.",
      "fix_suggestion": "",
      "key_variables": [],
      "key_statements": [],
      "scenario_matched": "",
      "property_verified": "",
      "static_check_type": "",
      "source": "",
      "static_confirmed": null,
      "static_check_reason": ""
    },
    {
      "title": "Predictable randomness via block.timestamp",
      "category": "bad_randomness",
      "severity": "medium",
      "confidence": 0.5,
      "evidence": {
        "file": "timestampdependent.sol",
        "lines": [
          22
        ],
        "function": "randomGen"
      },
      "explanation": "randomGen() returns block.timestamp, which is known to miners and can be manipulated within a small range. This makes the \u2018random\u2019 number trivially predictable or biased.",
      "fix_suggestion": "",
      "key_variables": [],
      "key_statements": [],
      "scenario_matched": "",
      "property_verified": "",
      "static_check_type": "",
      "source": "",
      "static_confirmed": null,
      "static_check_reason": ""
    },
    {
      "title": "Timestamp\u2010dependent logic",
      "category": "time_manipulation",
      "severity": "medium",
      "confidence": 0.5,
      "evidence": {
        "file": "timestampdependent.sol",
        "lines": [
          8
        ],
        "function": "payOut"
      },
      "explanation": "The condition now - rand > 24 hours relies on block.timestamp, which miners can shift by up to ~15 seconds. They could delay or accelerate payout conditions maliciously.",
      "fix_suggestion": "",
      "key_variables": [],
      "key_statements": [],
      "scenario_matched": "",
      "property_verified": "",
      "static_check_type": "",
      "source": "",
      "static_confirmed": null,
      "static_check_reason": ""
    }
  ],
  "parse_errors": [],
  "finding_count": 4,
  "ground_truth": [
    {
      "category": "time_manipulation",
      "lines": [
        13
      ],
      "title": "Time Manipulation"
    },
    {
      "category": "time_manipulation",
      "lines": [
        27
      ],
      "title": "Time Manipulation"
    }
  ],
  "metrics": {
    "category_metrics": {
      "precision": 0.25,
      "recall": 1.0,
      "f1": 0.4,
      "tp": 1,
      "fp": 3,
      "fn": 0,
      "pred_categories": [
        "time_manipulation",
        "denial_of_service",
        "unchecked_low_level_calls",
        "bad_randomness"
      ],
      "gt_categories": [
        "time_manipulation"
      ],
      "matched_categories": [
        "time_manipulation"
      ],
      "missed_categories": [],
      "spurious_categories": [
        "denial_of_service",
        "unchecked_low_level_calls",
        "bad_randomness"
      ],
      "unknown_predictions": 0
    },
    "instance_metrics": {
      "precision": 0.0,
      "recall": 0.0,
      "f1": 0.0,
      "tp": 0,
      "fp": 4,
      "fn": 2,
      "matched_instances": [],
      "unmatched_predictions": [
        {
          "category": "unchecked_low_level_calls",
          "lines": [
            9,
            12
          ],
          "title": "Unchecked send return values"
        },
        {
          "category": "denial_of_service",
          "lines": [
            12
          ],
          "title": "Potential DoS via failed send"
        },
        {
          "category": "bad_randomness",
          "lines": [
            22
          ],
          "title": "Predictable randomness via block.timestamp"
        },
        {
          "category": "time_manipulation",
          "lines": [
            8
          ],
          "title": "Timestamp\u2010dependent logic"
        }
      ],
      "unmatched_ground_truth": [
        {
          "category": "time_manipulation",
          "lines": [
            13
          ]
        },
        {
          "category": "time_manipulation",
          "lines": [
            27
          ]
        }
      ],
      "has_line_annotations": true
    },
    "precision": 0.25,
    "recall": 1.0,
    "f1": 0.4,
    "tp": 1,
    "fp": 3,
    "fn": 0,
    "pred_categories": [
      "time_manipulation",
      "denial_of_service",
      "unchecked_low_level_calls",
      "bad_randomness"
    ],
    "gt_categories": [
      "time_manipulation"
    ],
    "matched_categories": [
      "time_manipulation"
    ],
    "missed_categories": [],
    "spurious_categories": [
      "denial_of_service",
      "unchecked_low_level_calls",
      "bad_randomness"
    ],
    "unknown_predictions": 0
  },
  "loc": {
    "loc_total": 33,
    "loc_code": 24,
    "loc_comments": 4,
    "loc_blank": 5
  },
  "runner_metadata": {
    "parse_errors": [],
    "raw_output": "Part 1: Project Background  \nThe `lottopollo` contract is a simple \u201clottery\u201d\u2010style prototype that lets participants try to become the \u201cleader\u201d by staking at least 1 ETH, and after a 24 hour window anyone can trigger a payout. Internally it  \n\u2022 Maintains a `leader` address and a `timestamp` value.  \n\u2022 Uses `draw()` to generate a \u201crandom\u201d number (`block.timestamp`) and pass it to `payOut`.  \n\u2022 In `payOut`, if more than 24 hours have elapsed since the stored value, the caller is refunded and the current leader takes the remaining balance. Otherwise, if the caller sent \u2265 1 ETH, they become the new leader and their timestamp is recorded.\n\nGoals:  \n\u2022 Let players compete by staking ETH to become the leader.  \n\u2022 After 24 hours from the last \u201cwin\u201d event, a new caller can trigger a payout that returns their stake and awards the pot to the leader.\n\nPart 2: Function Listing and Call Relationships  \n(Line numbers approximate the snippet as provided.)\n\n1\u20135   Storage  \n  \u2022 `leader` (address)  \n  \u2022 `timestamp` (uint)\n\n6\u201318  function payOut(uint rand) internal  \n  \u2022 Line 8: Checks `rand > 0 && now - rand > 24 hours`.  \n    \u2013 If true:  \n      \u2022 Line 9: `msg.sender.send(msg.value)` refunds the caller.  \n      \u2022 Lines 11\u201312: If any balance remains, forward it to `leader`.  \n    \u2013 Else if `msg.value >= 1 ether` (Line 15): register caller as new `leader` and record `timestamp = rand`.\n\n20\u201323 function randomGen() constant returns (uint)  \n  \u2022 Always returns `block.timestamp`.\n\n24\u201327 function draw(uint seed)  \n  \u2022 Calls `randomGen()` to get `randomNumber` (Line 25).  \n  \u2022 Calls `payOut(randomNumber)` (Line 26).  \n\nCall graph:  \ndraw() \u2192 randomGen() \u2192 payOut()\n\nPart 3: DASP Top 10 Vulnerability Audit  \nMapping of categories (1 = present, 0 = absent):\n\n{\n  reentrancy: 0,\n  access_control: 0,\n  arithmetic: 0,\n  unchecked_low_level_calls: 1,\n  denial_of_service: 1,\n  bad_randomness: 1,\n  front_running: 0,\n  time_manipulation: 1,\n  short_addresses: 0,\n  other: 0\n}\n\nVulnerabilities found:\n\n1. unchecked_low_level_calls (payOut: lines 9, 12)  \n   \u2022 Uses `address.send(...)` without checking the return value.\n\n2. denial_of_service (payOut: line 12)  \n   \u2022 If `leader.send(...)` fails, funds remain locked in contract.\n\n3. bad_randomness (randomGen: line 22)  \n   \u2022 Uses `block.timestamp` as a source of randomness\u2014predictable by miners.\n\n4. time_manipulation (payOut: line 8)  \n   \u2022 Relies on `now` for time\u2010based conditional logic\u2014miners can shift timestamps.\n\nPart 4: JSON Output  \n```json\n[\n  {\n    \"category\": \"unchecked_low_level_calls\",\n    \"title\": \"Unchecked send return values\",\n    \"evidence\": {\n      \"file\": \"timestampdependent.sol\",\n      \"lines\": [9, 12],\n      \"function\": \"payOut\"\n    },\n    \"explanation\": \"The contract uses address.send(...) to transfer Ether but does not verify the Boolean return value. This can silently fail and leave the caller or leader unfunded without reverting.\",\n    \"influence_scope\": {\n      \"functions\": [\"payOut\"],\n      \"lines\": [9, 12]\n    }\n  },\n  {\n    \"category\": \"denial_of_service\",\n    \"title\": \"Potential DoS via failed send\",\n    \"evidence\": {\n      \"file\": \"timestampdependent.sol\",\n      \"lines\": [12],\n      \"function\": \"payOut\"\n    },\n    \"explanation\": \"If sending the contract balance to the leader fails (e.g., due to a malicious fallback or out\u2010of\u2010gas), funds remain stuck in the contract and no recovery path is provided.\",\n    \"influence_scope\": {\n      \"functions\": [\"payOut\"],\n      \"lines\": [11, 12]\n    }\n  },\n  {\n    \"category\": \"bad_randomness\",\n    \"title\": \"Predictable randomness via block.timestamp\",\n    \"evidence\": {\n      \"file\": \"timestampdependent.sol\",\n      \"lines\": [22],\n      \"function\": \"randomGen\"\n    },\n    \"explanation\": \"randomGen() returns block.timestamp, which is known to miners and can be manipulated within a small range. This makes the \u2018random\u2019 number trivially predictable or biased.\",\n    \"influence_scope\": {\n      \"functions\": [\"randomGen\", \"draw\", \"payOut\"],\n      \"lines\": [20, 22, 25, 26]\n    }\n  },\n  {\n    \"category\": \"time_manipulation\",\n    \"title\": \"Timestamp\u2010dependent logic\",\n    \"evidence\": {\n      \"file\": \"timestampdependent.sol\",\n      \"lines\": [8],\n      \"function\": \"payOut\"\n    },\n    \"explanation\": \"The condition now - rand > 24 hours relies on block.timestamp, which miners can shift by up to ~15 seconds. They could delay or accelerate payout conditions maliciously.\",\n    \"influence_scope\": {\n      \"functions\": [\"payOut\"],\n      \"lines\": [8]\n    }\n  }\n]\n```",
    "rendered_prompt": "You are a smart contract analyzer. You need to fully read the smart contracts code that I provide you later and understand and also carefully consider the inner logics of functions, explain the function call relationship, and the role of the call. There is no need to explain ERC20, ERC721, ERC777 function, and also function variable naming convention and other information. After that, you need to lead me to fully understand them.\n\nResponse requirements:\nDivide the analysis into three parts. You are required to strictly follow the steps of first, second and third part to think step by step when giving responses.\n\nIn the first part: introduce the project background, what tasks the contracts are executing, and the goals they aim to achieve.\n\nIn the second part: identify the function locations by line number, the purpose of each function, and whether there are any call relationships. If there are, explain how the functions are called and the purpose of these calls.\n\nIn the third part: You should further audit the above file. Here are the DASP Top 10 vulnerability categories: {reentrancy, access_control, arithmetic, unchecked_low_level_calls, denial_of_service, bad_randomness, front_running, time_manipulation, short_addresses, other}. You need to combine the context and comprehensive analysis to detect whether there are the mentioned vulnerabilities in smart contracts. If it exists, answer 1. Otherwise, answer 0 such as {reentrancy: 1, ..., other: 0}. Moreover, you need to locate these vulnerabilities in smart contracts and show me the code snippets that have these vulnerabilities, such as {function withdraw {...}} and show the scope of vulnerabilities' influence {what functions and what lines of code are influenced}.\n\nIn the fourth part: After completing the analysis above, compile your findings into a JSON array for systematic processing:\n\n```json\n[\n  {\n    \"category\": \"DASP category (reentrancy, access_control, arithmetic, etc.)\",\n    \"title\": \"Brief vulnerability title\",\n    \"evidence\": {\n      \"file\": \"filename.sol\",\n      \"lines\": [line_numbers],\n      \"function\": \"functionName\"\n    },\n    \"explanation\": \"Detailed explanation of the vulnerability and how it could be exploited\",\n    \"influence_scope\": {\n      \"functions\": [\"list\", \"of\", \"affected\", \"functions\"],\n      \"lines\": [list, of, affected, lines]\n    }\n  }\n]\n```\n\nReturn [] if no vulnerabilities are found after completing the full analysis.\n\n---\n\n## CONTRACT TO AUDIT:\n```solidity\n/*\n * @source: https://github.com/seresistvanandras/EthBench/blob/master/Benchmark/Simple/timestampdependent.sol\n * @author: -\n \n */\n\npragma solidity ^0.4.0;\ncontract lottopollo {\n  address leader;\n  uint    timestamp;\n  function payOut(uint rand) internal {\n    \n    if ( rand> 0 && now - rand > 24 hours ) {\n      msg.sender.send( msg.value );\n\n      if ( this.balance > 0 ) {\n        leader.send( this.balance );\n      }\n    }\n    else if ( msg.value >= 1 ether ) {\n      leader = msg.sender;\n      timestamp = rand;\n    }\n  }\n  function randomGen() constant returns (uint randomNumber) {\n      \n      return block.timestamp;   \n    }\n  function draw(uint seed){\n    uint randomNumber=randomGen(); \n    payOut(randomNumber);\n  }\n}\n```\n\nNow perform the complete analysis. Think step by step through each part before providing your final JSON output.",
    "api_calls": 1,
    "latency_s": 30.088831901550293,
    "prompt_tokens": 740,
    "completion_tokens": 3398,
    "total_tokens": 4138,
    "cost_usd": 0.0157652
  }
}