{
  "findings": [
    {
      "title": "Reentrancy in Collect",
      "category": "reentrancy",
      "severity": "medium",
      "confidence": 0.5,
      "evidence": {
        "file": "PENNY_BY_PENNY.sol",
        "lines": [
          60,
          61,
          62,
          63
        ],
        "function": "Collect"
      },
      "explanation": "The contract calls msg.sender.call.value(_am)() before updating the user\u2019s balance, allowing a malicious fallback to reenter Collect() and withdraw multiple times before balance is decremented.",
      "fix_suggestion": "",
      "key_variables": [],
      "key_statements": [],
      "scenario_matched": "",
      "property_verified": "",
      "static_check_type": "",
      "source": "",
      "static_confirmed": null,
      "static_check_reason": ""
    },
    {
      "title": "Missing Access Control on Admin Setters",
      "category": "access_control",
      "severity": "medium",
      "confidence": 0.5,
      "evidence": {
        "file": "PENNY_BY_PENNY.sol",
        "lines": [
          22,
          29,
          36
        ],
        "function": "SetMinSum, SetLogFile, Initialized"
      },
      "explanation": "All three functions are public and unrestricted, so *any* address can configure critical parameters before initialization or call Initialized() prematurely.",
      "fix_suggestion": "",
      "key_variables": [],
      "key_statements": [],
      "scenario_matched": "",
      "property_verified": "",
      "static_check_type": "",
      "source": "",
      "static_confirmed": null,
      "static_check_reason": ""
    },
    {
      "title": "Unchecked Integer Operations",
      "category": "arithmetic",
      "severity": "medium",
      "confidence": 0.5,
      "evidence": {
        "file": "PENNY_BY_PENNY.sol",
        "lines": [
          47,
          62
        ],
        "function": "Put, Collect"
      },
      "explanation": "The code modifies balances using `+=` and `-=` without SafeMath, risking overflow or underflow if extreme values are manipulated.",
      "fix_suggestion": "",
      "key_variables": [],
      "key_statements": [],
      "scenario_matched": "",
      "property_verified": "",
      "static_check_type": "",
      "source": "",
      "static_confirmed": null,
      "static_check_reason": ""
    },
    {
      "title": "Use of Low-Level call.value",
      "category": "unchecked_low_level_calls",
      "severity": "medium",
      "confidence": 0.5,
      "evidence": {
        "file": "PENNY_BY_PENNY.sol",
        "lines": [
          60
        ],
        "function": "Collect"
      },
      "explanation": "The contract uses `msg.sender.call.value()` which forwards all remaining gas and can introduce unexpected behavior or failures. The recommended pattern is `transfer` or `send` with proper error handling.",
      "fix_suggestion": "",
      "key_variables": [],
      "key_statements": [],
      "scenario_matched": "",
      "property_verified": "",
      "static_check_type": "",
      "source": "",
      "static_confirmed": null,
      "static_check_reason": ""
    },
    {
      "title": "External LogFile Dependencies Can Block Execution",
      "category": "denial_of_service",
      "severity": "medium",
      "confidence": 0.5,
      "evidence": {
        "file": "PENNY_BY_PENNY.sol",
        "lines": [
          49,
          63
        ],
        "function": "Put, Collect"
      },
      "explanation": "Both `Put` and `Collect` call `Log.AddMessage`. If the LogFile contract is malicious or runs out of gas, these calls will revert and prevent deposits or withdrawals from succeeding.",
      "fix_suggestion": "",
      "key_variables": [],
      "key_statements": [],
      "scenario_matched": "",
      "property_verified": "",
      "static_check_type": "",
      "source": "",
      "static_confirmed": null,
      "static_check_reason": ""
    }
  ],
  "parse_errors": [],
  "finding_count": 5,
  "ground_truth": [
    {
      "category": "reentrancy",
      "lines": [
        63
      ],
      "title": "Reentrancy"
    }
  ],
  "metrics": {
    "category_metrics": {
      "precision": 0.2,
      "recall": 1.0,
      "f1": 0.33333333333333337,
      "tp": 1,
      "fp": 4,
      "fn": 0,
      "pred_categories": [
        "access_control",
        "denial_of_service",
        "arithmetic",
        "reentrancy",
        "unchecked_low_level_calls"
      ],
      "gt_categories": [
        "reentrancy"
      ],
      "matched_categories": [
        "reentrancy"
      ],
      "missed_categories": [],
      "spurious_categories": [
        "arithmetic",
        "access_control",
        "unchecked_low_level_calls",
        "denial_of_service"
      ],
      "unknown_predictions": 0
    },
    "instance_metrics": {
      "precision": 0.2,
      "recall": 1.0,
      "f1": 0.33333333333333337,
      "tp": 1,
      "fp": 4,
      "fn": 0,
      "matched_instances": [
        {
          "category": "reentrancy",
          "pred_lines": [
            60,
            61,
            62,
            63
          ],
          "gt_lines": [
            63
          ],
          "function": "Collect"
        }
      ],
      "unmatched_predictions": [
        {
          "category": "access_control",
          "lines": [
            36,
            29,
            22
          ],
          "title": "Missing Access Control on Admin Setters"
        },
        {
          "category": "arithmetic",
          "lines": [
            62,
            47
          ],
          "title": "Unchecked Integer Operations"
        },
        {
          "category": "unchecked_low_level_calls",
          "lines": [
            60
          ],
          "title": "Use of Low-Level call.value"
        },
        {
          "category": "denial_of_service",
          "lines": [
            49,
            63
          ],
          "title": "External LogFile Dependencies Can Block Execution"
        }
      ],
      "unmatched_ground_truth": [],
      "has_line_annotations": true
    },
    "precision": 0.2,
    "recall": 1.0,
    "f1": 0.33333333333333337,
    "tp": 1,
    "fp": 4,
    "fn": 0,
    "pred_categories": [
      "access_control",
      "denial_of_service",
      "arithmetic",
      "reentrancy",
      "unchecked_low_level_calls"
    ],
    "gt_categories": [
      "reentrancy"
    ],
    "matched_categories": [
      "reentrancy"
    ],
    "missed_categories": [],
    "spurious_categories": [
      "arithmetic",
      "access_control",
      "unchecked_low_level_calls",
      "denial_of_service"
    ],
    "unknown_predictions": 0
  },
  "loc": {
    "loc_total": 103,
    "loc_code": 80,
    "loc_comments": 4,
    "loc_blank": 19
  },
  "runner_metadata": {
    "parse_errors": [],
    "raw_output": "First, here is a concise mapping of which DASP categories we found (1 = present, 0 = not present):\n\n```json\n{\n  \"reentrancy\": 1,\n  \"access_control\": 1,\n  \"arithmetic\": 1,\n  \"unchecked_low_level_calls\": 1,\n  \"denial_of_service\": 1,\n  \"bad_randomness\": 0,\n  \"front_running\": 0,\n  \"time_manipulation\": 0,\n  \"short_addresses\": 0,\n  \"other\": 0\n}\n```\n\n---\n\nPART 1 \u2013 PROJECT BACKGROUND  \nThe `PENNY_BY_PENNY` system is a very simple Ether\u2010locking contract.  Users can:\n\n1. Deposit (via `Put`) an arbitrary amount of Ether and set a lock period.\n2. Once the lock period has passed *and* the user\u2019s balance is above a configurable minimum sum, they can withdraw (via `Collect`).\n3. All actions are logged to an external `LogFile` contract.  \n\nAn administrator (in practice *any* address during initialization) can set the minimum lockable sum and the address of the log contract exactly once before \"initializing\" the system.  After initialization, those parameters become immutable.\n\n---\n\nPART 2 \u2013 FUNCTIONS, LINE NUMBERS, PURPOSE & CALL RELATIONSHIPS\n\n(Note: line numbers are approximate to the code block as given.)\n\n1. **SetMinSum** (lines 22\u201327)  \n   - Public.  Sets `MinSum` only if not yet initialized.  \n   - No access control \u2192 *anyone* can run this before initialization.\n\n2. **SetLogFile** (lines 29\u201334)  \n   - Public.  Sets the external `LogFile` address only if not yet initialized.  \n   - No access control \u2192 *anyone* can run this before initialization.\n\n3. **Initialized** (lines 36\u201340)  \n   - Public.  Flips the `intitalized` flag to `true`.  \n   - Once called, admin setters above can no longer be invoked.  \n   - Again, no access control \u2192 *anyone* can finalize.\n\n4. **Put** (lines 42\u201350)  \n   - `payable`.  Increases the caller\u2019s `Acc[msg.sender].balance` by `msg.value`.  \n   - Updates the per\u2010user `unlockTime` if the new lock length is longer.  \n   - Calls `Log.AddMessage(...)` in the `LogFile` contract.\n\n5. **Collect** (lines 52\u201366)  \n   - `payable` (but does not require `msg.value`).  \n   - Checks three conditions:  \n     a) User\u2019s balance \u2265 `MinSum`  \n     b) User\u2019s balance \u2265 requested withdrawal amount `_am`  \n     c) Current time > user\u2019s `unlockTime`  \n   - Executes `msg.sender.call.value(_am)()` to transfer Ether.  \n   - If that low\u2010level call succeeds, subtracts `_am` from user\u2019s balance and logs the action via `Log.AddMessage`.\n\n6. **fallback** (lines 68\u201373)  \n   - Redirects plain transfers into a `Put(0)` call, so funds can always be deposited without explicit lock time.\n\n7. **LogFile.AddMessage** (in the `LogFile` contract at lines 77\u201396)  \n   - Simply appends a message struct to an in\u2010storage push, logging address, value, data string and timestamp.\n\nCall Graph highlights:\n- `Put` \u21a6 external `Log.AddMessage`\n- `Collect` \u21a6 low\u2010level `msg.sender.call.value` \u21a6 then external `Log.AddMessage`\n- fallback \u21a6 `Put`\n\n---\n\nPART 3 \u2013 VULNERABILITY AUDIT (DASP TOP 10)\n\n1. **reentrancy (1)**  \n   - In `Collect` (lines 60\u201363), the contract uses `msg.sender.call.value(...)()` *before* updating the caller\u2019s balance.  \n   - A malicious contract could reenter `Collect` in its fallback and drain more funds than allowed.\n\n2. **access_control (1)**  \n   - `SetMinSum`, `SetLogFile` and `Initialized` are all public with *no* owner or ACL.  \n   - Any address can configure or finalize the contract\u2019s parameters.\n\n3. **arithmetic (1)**  \n   - No SafeMath used in `acc.balance += msg.value;` (line 47) or `acc.balance -= _am;` (line 62).  \n   - Possible overflow/underflow if extreme values are used.\n\n4. **unchecked_low_level_calls (1)**  \n   - The contract uses the low\u2010level `.call.value(...)()` pattern in `Collect` (line 60) rather than `transfer` or `send` with explicit gas limits.  \n   - Even though it checks the return, using low\u2010level calls remains discouraged.\n\n5. **denial_of_service (1)**  \n   - The external logging calls in `Put` (line 49) and in `Collect` (line 63) can revert if `LogFile` is malicious or out of gas, blocking deposits or withdrawals entirely.\n\nAll other categories were not found.\n\n---\n\nPART 4 \u2013 STRUCTURED JSON OUTPUT  \n\n```json\n[\n  {\n    \"category\": \"reentrancy\",\n    \"title\": \"Reentrancy in Collect\",\n    \"evidence\": {\n      \"file\": \"PENNY_BY_PENNY.sol\",\n      \"lines\": [60, 61, 62, 63],\n      \"function\": \"Collect\"\n    },\n    \"explanation\": \"The contract calls msg.sender.call.value(_am)() before updating the user\u2019s balance, allowing a malicious fallback to reenter Collect() and withdraw multiple times before balance is decremented.\",\n    \"influence_scope\": {\n      \"functions\": [\"Collect\"],\n      \"lines\": [60, 61, 62]\n    }\n  },\n  {\n    \"category\": \"access_control\",\n    \"title\": \"Missing Access Control on Admin Setters\",\n    \"evidence\": {\n      \"file\": \"PENNY_BY_PENNY.sol\",\n      \"lines\": [22, 29, 36],\n      \"function\": \"SetMinSum, SetLogFile, Initialized\"\n    },\n    \"explanation\": \"All three functions are public and unrestricted, so *any* address can configure critical parameters before initialization or call Initialized() prematurely.\",\n    \"influence_scope\": {\n      \"functions\": [\"SetMinSum\", \"SetLogFile\", \"Initialized\"],\n      \"lines\": [22, 23, 24, 29, 30, 31, 36, 37, 38]\n    }\n  },\n  {\n    \"category\": \"arithmetic\",\n    \"title\": \"Unchecked Integer Operations\",\n    \"evidence\": {\n      \"file\": \"PENNY_BY_PENNY.sol\",\n      \"lines\": [47, 62],\n      \"function\": \"Put, Collect\"\n    },\n    \"explanation\": \"The code modifies balances using `+=` and `-=` without SafeMath, risking overflow or underflow if extreme values are manipulated.\",\n    \"influence_scope\": {\n      \"functions\": [\"Put\", \"Collect\"],\n      \"lines\": [47, 62]\n    }\n  },\n  {\n    \"category\": \"unchecked_low_level_calls\",\n    \"title\": \"Use of Low-Level call.value\",\n    \"evidence\": {\n      \"file\": \"PENNY_BY_PENNY.sol\",\n      \"lines\": [60],\n      \"function\": \"Collect\"\n    },\n    \"explanation\": \"The contract uses `msg.sender.call.value()` which forwards all remaining gas and can introduce unexpected behavior or failures. The recommended pattern is `transfer` or `send` with proper error handling.\",\n    \"influence_scope\": {\n      \"functions\": [\"Collect\"],\n      \"lines\": [60]\n    }\n  },\n  {\n    \"category\": \"denial_of_service\",\n    \"title\": \"External LogFile Dependencies Can Block Execution\",\n    \"evidence\": {\n      \"file\": \"PENNY_BY_PENNY.sol\",\n      \"lines\": [49, 63],\n      \"function\": \"Put, Collect\"\n    },\n    \"explanation\": \"Both `Put` and `Collect` call `Log.AddMessage`. If the LogFile contract is malicious or runs out of gas, these calls will revert and prevent deposits or withdrawals from succeeding.\",\n    \"influence_scope\": {\n      \"functions\": [\"Put\", \"Collect\"],\n      \"lines\": [49, 63]\n    }\n  }\n]\n```\n\nIf you need any further deep dives or remediations, let me know!",
    "rendered_prompt": "You are a smart contract analyzer. You need to fully read the smart contracts code that I provide you later and understand and also carefully consider the inner logics of functions, explain the function call relationship, and the role of the call. There is no need to explain ERC20, ERC721, ERC777 function, and also function variable naming convention and other information. After that, you need to lead me to fully understand them.\n\nResponse requirements:\nDivide the analysis into three parts. You are required to strictly follow the steps of first, second and third part to think step by step when giving responses.\n\nIn the first part: introduce the project background, what tasks the contracts are executing, and the goals they aim to achieve.\n\nIn the second part: identify the function locations by line number, the purpose of each function, and whether there are any call relationships. If there are, explain how the functions are called and the purpose of these calls.\n\nIn the third part: You should further audit the above file. Here are the DASP Top 10 vulnerability categories: {reentrancy, access_control, arithmetic, unchecked_low_level_calls, denial_of_service, bad_randomness, front_running, time_manipulation, short_addresses, other}. You need to combine the context and comprehensive analysis to detect whether there are the mentioned vulnerabilities in smart contracts. If it exists, answer 1. Otherwise, answer 0 such as {reentrancy: 1, ..., other: 0}. Moreover, you need to locate these vulnerabilities in smart contracts and show me the code snippets that have these vulnerabilities, such as {function withdraw {...}} and show the scope of vulnerabilities' influence {what functions and what lines of code are influenced}.\n\nIn the fourth part: After completing the analysis above, compile your findings into a JSON array for systematic processing:\n\n```json\n[\n  {\n    \"category\": \"DASP category (reentrancy, access_control, arithmetic, etc.)\",\n    \"title\": \"Brief vulnerability title\",\n    \"evidence\": {\n      \"file\": \"filename.sol\",\n      \"lines\": [line_numbers],\n      \"function\": \"functionName\"\n    },\n    \"explanation\": \"Detailed explanation of the vulnerability and how it could be exploited\",\n    \"influence_scope\": {\n      \"functions\": [\"list\", \"of\", \"affected\", \"functions\"],\n      \"lines\": [list, of, affected, lines]\n    }\n  }\n]\n```\n\nReturn [] if no vulnerabilities are found after completing the full analysis.\n\n---\n\n## CONTRACT TO AUDIT:\n```solidity\n/*\n * @source: etherscan.io \n * @author: -\n \n */\n\npragma solidity ^0.4.19;\n\ncontract PENNY_BY_PENNY  \n{\n    struct Holder   \n    {\n        uint unlockTime;\n        uint balance;\n    }\n    \n    mapping (address => Holder) public Acc;\n    \n    uint public MinSum;\n    \n    LogFile Log;\n    \n    bool intitalized;\n    \n    function SetMinSum(uint _val)\n    public\n    {\n        if(intitalized)throw;\n        MinSum = _val;\n    }\n    \n    function SetLogFile(address _log)\n    public\n    {\n        if(intitalized)throw;\n        Log = LogFile(_log);\n    }\n    \n    function Initialized()\n    public\n    {\n        intitalized = true;\n    }\n    \n    function Put(uint _lockTime)\n    public\n    payable\n    {\n        var acc = Acc[msg.sender];\n        acc.balance += msg.value;\n        if(now+_lockTime>acc.unlockTime)acc.unlockTime=now+_lockTime;\n        Log.AddMessage(msg.sender,msg.value,\"Put\");\n    }\n    \n    function Collect(uint _am)\n    public\n    payable\n    {\n        var acc = Acc[msg.sender];\n        if( acc.balance>=MinSum && acc.balance>=_am && now>acc.unlockTime)\n        {\n            \n            if(msg.sender.call.value(_am)())\n            {\n                acc.balance-=_am;\n                Log.AddMessage(msg.sender,_am,\"Collect\");\n            }\n        }\n    }\n    \n    function() \n    public \n    payable\n    {\n        Put(0);\n    }\n    \n}\n\ncontract LogFile\n{\n    struct Message\n    {\n        address Sender;\n        string  Data;\n        uint Val;\n        uint  Time;\n    }\n    \n    Message[] public History;\n    \n    Message LastMsg;\n    \n    function AddMessage(address _adr,uint _val,string _data)\n    public\n    {\n        LastMsg.Sender = _adr;\n        LastMsg.Time = now;\n        LastMsg.Val = _val;\n        LastMsg.Data = _data;\n        History.push(LastMsg);\n    }\n}\n```\n\nNow perform the complete analysis. Think step by step through each part before providing your final JSON output.",
    "api_calls": 1,
    "latency_s": 36.04154419898987,
    "prompt_tokens": 996,
    "completion_tokens": 4097,
    "total_tokens": 5093,
    "cost_usd": 0.0191224
  }
}